url,headline,img_path
/en/news-in-english/19/2253242/lithuania-mulls-special-fund-to-finance-defence,Lithuania mulls special fund to finance defence,/img/2024/03/21/1732652-463564-150x84.jpg
/en/news-in-english/19/2253155/security-tops-lithuanian-voter-concerns-in-ep-elections-survey,Security tops Lithuanian voter concerns in EP elections – survey,/img/2024/04/05/1744335-254428-150x84.jpg
/en/news-in-english/19/2252000/lithuania-s-ambassador-to-spain-slightly-injured-in-car-accident-in-vilnius,Lithuania‘s ambassador to Spain slightly injured in car accident in Vilnius,/img/2024/04/09/1746131-999482-150x84.jpg
/en/news-in-english/19/2251372/tradition-that-survived-wars-and-occupations-lithuania-prepares-for-centennial-song-festival,Tradition that survived wars and occupations: Lithuania prepares for centennial Song Festival,/img/2024/02/20/1706210-344234-150x84.jpg
/en/news-in-english/19/2251861/israeli-success-must-lead-to-strengthening-of-ukraine-s-air-defence-lithuanian-fm,Israeli success must lead to strengthening of Ukraine’s air defence – Lithuanian FM,/img/2024/04/14/1749862-211875-150x84.jpg
/en/news-in-english/19/2251701/deal-with-rheinmetall-includes-ammunition-supply-to-lithuania-minister,Deal with Rheinmetall includes ammunition supply to Lithuania – minister,/img/2024/04/17/1751999-413688-150x84.jpg
/en/news-in-english/19/2250994/lithuania-s-presidential-election-candidates-on-family-same-sex-unions-and-abortion,"Lithuania’s presidential election: candidates on family, same-sex unions, and abortion",/img/2024/04/09/1746590-893104-150x84.jpg
/en/news-in-english/19/2251374/renovated-vilnius-tv-tower-offers-luxury-apartments-for-rent,Renovated Vilnius TV Tower offers luxury apartments for rent,/img/2024/04/16/1751592-845268-150x84.jpg
/en/news-in-english/19/2251229/scholz-to-visit-first-german-troops-deployed-in-lithuania-in-may-president,Scholz to visit first German troops deployed in Lithuania in May – president,/img/2022/06/07/1278643-991818-150x84.jpg
/en/news-in-english/19/2250919/aegean-airlines-to-launch-vilnius-athens-flights-on-friday,Aegean Airlines to launch Vilnius-Athens flights on Friday,/img/2024/04/16/1751175-366252-150x84.jpg
/en/news-in-english/19/2250892/20-000-troops-to-participate-in-spring-exercises-in-lithuania,"20,000 troops to participate in spring exercises in Lithuania",/img/2024/02/20/1706241-264107-150x84.jpg
/en/news-in-english/19/2250818/lithuania-should-opt-for-financial-contribution-to-eu-migration-reform-aide,Lithuania should opt for financial contribution to EU migration reform – aide,/img/2024/03/11/1724252-559401-150x84.jpg
/en/news-in-english/19/2250766/lithuania-signs-letter-of-intent-with-germany-s-rheinmetall-on-ammunition-plant,Lithuania signs letter of intent with Germany’s Rheinmetall on ammunition plant,/img/2023/11/17/1628963-79215-150x84.jpg
/en/news-in-english/19/2250331/bikes-and-scooters-in-vilnius-how-to-park-to-avoid-trouble,Bikes and scooters in Vilnius: how to park to avoid trouble?,/img/2024/04/12/1749152-814274-150x84.jpg
/en/news-in-english/19/2250374/radviliskis-mayor-welcomes-rheinmetall-s-factory-plans-local-community-voices-reservations,"Radviliškis mayor welcomes Rheinmetall’s factory plans, local community voices reservations",/img/2024/04/15/1750725-382920-150x84.jpg
/en/news-in-english/19/2250241/lithuanian-season-in-france-to-feature-art-photography-in-paris-metro-and-gastronomy,"Lithuanian Season in France to feature art, photography in Paris metro, and gastronomy",/img/2023/01/16/1429701-587473-150x84.jpg
/en/news-in-english/19/2250994/lithuania-s-presidential-election-candidates-on-family-same-sex-unions-and-abortion,"Lithuania’s presidential election: candidates on family, same-sex unions, and abortion",
/en/news-in-english/19/2251372/tradition-that-survived-wars-and-occupations-lithuania-prepares-for-centennial-song-festival,Tradition that survived wars and occupations: Lithuania prepares for centennial Song Festival,
/en/news-in-english/19/2253242/lithuania-mulls-special-fund-to-finance-defence,Lithuania mulls special fund to finance defence,/img/2024/03/21/1732652-463564-393x221.jpg
/en/news-in-english/19/2253155/security-tops-lithuanian-voter-concerns-in-ep-elections-survey,Security tops Lithuanian voter concerns in EP elections – survey,/img/2024/04/05/1744335-254428-393x221.jpg
/en/news-in-english/19/2252000/lithuania-s-ambassador-to-spain-slightly-injured-in-car-accident-in-vilnius,Lithuania‘s ambassador to Spain slightly injured in car accident in Vilnius,/img/2024/04/09/1746131-999482-393x221.jpg
/en/news-in-english/19/2253242/lithuania-mulls-special-fund-to-finance-defence,Lithuania mulls special fund to finance defence,/img/2024/03/21/1732652-463564-615x345.jpg
/en/news-in-english/19/2253155/security-tops-lithuanian-voter-concerns-in-ep-elections-survey,Security tops Lithuanian voter concerns in EP elections – survey,/img/2024/04/05/1744335-254428-393x221.jpg
/en/news-in-english/19/2252000/lithuania-s-ambassador-to-spain-slightly-injured-in-car-accident-in-vilnius,Lithuania‘s ambassador to Spain slightly injured in car accident in Vilnius,/img/2024/04/09/1746131-999482-393x221.jpg
/en/news-in-english/19/2251861/israeli-success-must-lead-to-strengthening-of-ukraine-s-air-defence-lithuanian-fm,Israeli success must lead to strengthening of Ukraine’s air defence – Lithuanian FM,/img/2024/04/14/1749862-211875-393x221.jpg
/en/news-in-english/19/2251701/deal-with-rheinmetall-includes-ammunition-supply-to-lithuania-minister,Deal with Rheinmetall includes ammunition supply to Lithuania – minister,/img/2024/04/17/1751999-413688-393x221.jpg
/en/news-in-english/19/2246799/lithuanian-mps-debate-restricting-belarusian-travel-home,Lithuanian MPs debate restricting Belarusian travel home,/img/2022/11/17/1384971-370918-615x345.jpg
/en/news-in-english/19/2246252/belarusian-businesses-in-lithuania-feel-the-squeeze-under-prospect-of-more-restrictions,Belarusian businesses in Lithuania feel the squeeze under prospect of more restrictions,/img/2024/03/29/1739263-799455-615x345.jpg
/en/news-in-english/19/2233999/belarusians-celebrated-freedom-day-in-vilnius-hoping-to-one-day-do-it-in-minsk,"Belarusians celebrated Freedom Day in Vilnius, hoping to one day do it in Minsk",/img/2024/03/25/1735544-749958-615x345.jpg
/en/news-in-english/19/2229382/funds-from-frozen-russian-assets-could-reach-ukraine-in-july-eu-commissioner,Funds from frozen Russian assets could reach Ukraine in July – EU commissioner,/img/2024/02/26/1713076-124391-615x345.jpg
/en/news-in-english/19/2251374/renovated-vilnius-tv-tower-offers-luxury-apartments-for-rent,Renovated Vilnius TV Tower offers luxury apartments for rent,/img/2024/04/16/1751592-845268-615x345.jpg
/en/news-in-english/19/2250919/aegean-airlines-to-launch-vilnius-athens-flights-on-friday,Aegean Airlines to launch Vilnius-Athens flights on Friday,/img/2024/04/16/1751175-366252-615x345.jpg
/en/news-in-english/19/2250331/bikes-and-scooters-in-vilnius-how-to-park-to-avoid-trouble,Bikes and scooters in Vilnius: how to park to avoid trouble?,/img/2024/04/12/1749152-814274-615x345.jpg
/en/news-in-english/19/2250374/radviliskis-mayor-welcomes-rheinmetall-s-factory-plans-local-community-voices-reservations,"Radviliškis mayor welcomes Rheinmetall’s factory plans, local community voices reservations",/img/2024/04/15/1750725-382920-615x345.jpg
/en/news-in-english/19/2251372/tradition-that-survived-wars-and-occupations-lithuania-prepares-for-centennial-song-festival,Tradition that survived wars and occupations: Lithuania prepares for centennial Song Festival,/img/2024/02/20/1706210-344234-615x345.jpg
/en/news-in-english/19/2250241/lithuanian-season-in-france-to-feature-art-photography-in-paris-metro-and-gastronomy,"Lithuanian Season in France to feature art, photography in Paris metro, and gastronomy",/img/2023/01/16/1429701-587473-615x345.jpg
/en/news-in-english/19/2249827/lithuanian-discus-thrower-breaks-the-oldest-men-s-athletics-world-record,Lithuanian discus thrower breaks the oldest men’s athletics world record,/img/2024/04/15/1750243-327067-615x345.jpg
/en/news-in-english/19/2247094/lithuanian-nature-lover-comes-across-rare-mushroom-thought-to-be-extinct,Lithuanian nature lover comes across rare mushroom thought to be extinct,/img/2024/04/10/1747076-722802-615x345.jpg
/en/news-in-english/19/2248444/poland-would-defend-lithuania-i-cannot-imagine-any-other-way-interview-with-president-duda,"Poland would defend Lithuania, I cannot imagine any other way – interview with President Duda",/img/2024/04/11/1748189-210647-615x345.jpg
/en/news-in-english/19/2248746/lrt-tapes-public-transport-in-vilnius-30-years-ago,LRT tapes. Public transport in Vilnius 30 years ago,/img/2024/04/12/1749342-614989-615x345.png
/en/news-in-english/19/2248571/argentinian-adrian-on-doing-business-and-parenting-in-lithuania-life-is-easier-here,Argentinian Adrian on doing business and parenting in Lithuania: ‘Life is easier here’,/img/2024/04/12/1749633-554594-615x345.jpg
/en/news-in-english/19/2247274/lrt-english-newsletter-government-fails-the-test,LRT English Newsletter: Government fails the test,/img/2024/03/22/1733749-201718-615x345.jpg
