url,headline,img_path
/en/news-in-english/19/2245875/temperature-rises-to-29-2-degrees-in-vilnius-on-tuesday,Temperature rises to 29.2 degrees in Vilnius on Tuesday,/img/2023/08/14/1568342-225674-150x84.jpg
/en/news-in-english/19/2245760/lithuania-in-talks-with-us-french-defence-industry-companies-minister,"Lithuania in talks with US, French defence industry companies – minister",/img/2024/03/19/1729533-100047-150x84.jpg
/en/news-in-english/19/2245757/strasbourg-court-opens-case-against-lithuania-over-penalising-migrant-aid-ngo,Strasbourg Court opens case against Lithuania over penalising migrant aid NGO,/img/2024/01/23/1686971-202187-150x84.jpg
/en/news-in-english/19/2245702/tajik-opposition-activist-arrested-in-lithuania-over-alleged-terrorist-links,Tajik opposition activist arrested in Lithuania over alleged terrorist links,/img/2024/04/09/1746039-82364-150x84.png
/en/news-in-english/19/2245590/aerial-bomb-discovered-during-excavation-in-vilnius,Aerial bomb discovered during excavation in Vilnius,/img/2024/04/09/1746215-789189-150x84.jpg
/en/news-in-english/19/2245480/vilnius-ends-heating-season,Vilnius ends heating season,/img/2024/04/02/1741718-602205-150x84.jpg
/en/news-in-english/19/2245422/person-suspected-of-attack-on-russian-embassy-detained-in-vilnius,Person suspected of attack on Russian Embassy detained in Vilnius,/img/2024/03/17/1728223-734062-150x84.jpg
/en/news-in-english/19/2245389/lithuanian-education-minister-quits-over-flawed-school-examination-system,Lithuanian education minister quits over flawed school examination system,/img/2024/03/23/1734039-885436-150x84.jpg
/en/news-in-english/19/2245242/lithuanian-president-fm-agree-on-ambassador-to-poland-aide,"Lithuanian president, FM agree on ambassador to Poland – aide",/img/2024/02/07/1697554-285867-150x84.jpg
/en/news-in-english/19/2244592/it-was-the-right-decision-how-lithuania-impeached-its-president-20-years-ago,‘It was the right decision’. How Lithuania impeached its president 20 years ago,/img/2021/04/09/901532-806458-150x84.jpg
/en/news-in-english/19/2244888/8-candidates-to-run-for-president-of-lithuania,8 candidates to run for president of Lithuania,/img/2024/04/08/1745490-944244-150x84.jpg
/en/news-in-english/19/2244867/one-person-injured-in-house-explosion-near-kaunas,One person injured in house explosion near Kaunas,/img/2024/04/08/1745599-984028-150x84.jpg
/en/news-in-english/19/2244755/lithuania-s-security-is-our-security-country-welcomes-first-german-troops,‘Lithuania’s security is our security’: country welcomes first German troops,/img/2024/04/08/1745474-416143-150x84.jpg
/en/news-in-english/19/2244587/kaunas-mayor-s-company-found-buyer-for-its-kaliningrad-plant-media,Kaunas mayor’s company found buyer for its Kaliningrad plant – media,/img/2023/03/09/1465071-289022-150x84.jpg
/en/news-in-english/19/2244488/former-military-chief-pocius-elected-to-lead-parliament-s-national-security-committee,Former military chief Pocius elected to lead parliament’s national security committee,/img/2023/01/12/1427153-613025-150x84.jpg
/en/news-in-english/19/2244471/lithuanian-troops-to-safeguard-3si-summit-in-vilnius,Lithuanian troops to safeguard 3SI summit in Vilnius,/img/2022/06/20/1288316-403557-150x84.jpg
/en/news-in-english/19/2244592/it-was-the-right-decision-how-lithuania-impeached-its-president-20-years-ago,‘It was the right decision’. How Lithuania impeached its president 20 years ago,
/en/news-in-english/19/2245702/tajik-opposition-activist-arrested-in-lithuania-over-alleged-terrorist-links,Tajik opposition activist arrested in Lithuania over alleged terrorist links,
/en/news-in-english/19/2245875/temperature-rises-to-29-2-degrees-in-vilnius-on-tuesday,Temperature rises to 29.2 degrees in Vilnius on Tuesday,/img/2023/08/14/1568342-225674-393x221.jpg
/en/news-in-english/19/2245760/lithuania-in-talks-with-us-french-defence-industry-companies-minister,"Lithuania in talks with US, French defence industry companies – minister",/img/2024/03/19/1729533-100047-393x221.jpg
/en/news-in-english/19/2245757/strasbourg-court-opens-case-against-lithuania-over-penalising-migrant-aid-ngo,Strasbourg Court opens case against Lithuania over penalising migrant aid NGO,/img/2024/01/23/1686971-202187-393x221.jpg
/en/news-in-english/19/2245760/lithuania-in-talks-with-us-french-defence-industry-companies-minister,"Lithuania in talks with US, French defence industry companies – minister",/img/2024/03/19/1729533-100047-615x345.jpg
/en/news-in-english/19/2245757/strasbourg-court-opens-case-against-lithuania-over-penalising-migrant-aid-ngo,Strasbourg Court opens case against Lithuania over penalising migrant aid NGO,/img/2024/01/23/1686971-202187-393x221.jpg
/en/news-in-english/19/2245702/tajik-opposition-activist-arrested-in-lithuania-over-alleged-terrorist-links,Tajik opposition activist arrested in Lithuania over alleged terrorist links,/img/2024/04/09/1746039-82364-393x221.png
/en/news-in-english/19/2245590/aerial-bomb-discovered-during-excavation-in-vilnius,Aerial bomb discovered during excavation in Vilnius,/img/2024/04/09/1746215-789189-393x221.jpg
/en/news-in-english/19/2245422/person-suspected-of-attack-on-russian-embassy-detained-in-vilnius,Person suspected of attack on Russian Embassy detained in Vilnius,/img/2024/03/17/1728223-734062-393x221.jpg
/en/news-in-english/19/2233999/belarusians-celebrated-freedom-day-in-vilnius-hoping-to-one-day-do-it-in-minsk,"Belarusians celebrated Freedom Day in Vilnius, hoping to one day do it in Minsk",/img/2024/03/25/1735544-749958-615x345.jpg
/en/news-in-english/19/2229382/funds-from-frozen-russian-assets-could-reach-ukraine-in-july-eu-commissioner,Funds from frozen Russian assets could reach Ukraine in July – EU commissioner,/img/2024/02/26/1713076-124391-615x345.jpg
/en/news-in-english/19/2229342/there-are-no-litvinist-groups-among-belarusian-diaspora-intelligence,There are no Litvinist groups among Belarusian diaspora – intelligence,/img/2024/03/07/1721370-510533-615x345.jpg
/en/news-in-english/19/2226498/lithuania-s-fm-slams-russian-election-as-tragic-farce,Lithuania’s FM slams Russian election as ‘tragic farce’,/img/2024/03/13/1725607-555391-615x345.jpg
/en/news-in-english/19/2245480/vilnius-ends-heating-season,Vilnius ends heating season,/img/2024/04/02/1741718-602205-615x345.jpg
/en/news-in-english/19/2244587/kaunas-mayor-s-company-found-buyer-for-its-kaliningrad-plant-media,Kaunas mayor’s company found buyer for its Kaliningrad plant – media,/img/2023/03/09/1465071-289022-615x345.jpg
/en/news-in-english/19/2242991/disgrace-or-heritage-a-unique-district-dubbed-shanghai-of-vilnius,Disgrace or heritage? A unique district dubbed Shanghai of Vilnius,/img/2024/04/03/1742604-758386-615x345.jpg
/en/news-in-english/19/2241962/lithuania-mulls-banning-chinese-software-in-private-power-plants-minister,Lithuania mulls banning Chinese software in private power plants – minister,/img/2019/07/26/480414-694414-615x345.jpg
/en/news-in-english/19/2245875/temperature-rises-to-29-2-degrees-in-vilnius-on-tuesday,Temperature rises to 29.2 degrees in Vilnius on Tuesday,/img/2023/08/14/1568342-225674-615x345.jpg
/en/news-in-english/19/2241491/lithuania-s-only-amsterdam-school-style-building-in-kaunas-houses-unique-museum,Lithuania’s only Amsterdam School-style building in Kaunas houses unique museum,/img/2024/03/28/1739092-350642-615x345.jpg
/en/news-in-english/19/2243302/rubbish-province-of-russia-vilnius-residents-slam-new-tourism-promotion-campaign,‘Rubbish province of Russia’: Vilnius residents slam new tourism promotion campaign,/img/2024/04/05/1744212-845338-615x345.jpg
/en/news-in-english/19/2242189/new-campaign-invites-brits-germans-to-break-stereotypes-about-vilnius,"New campaign invites Brits, Germans to break stereotypes about Vilnius",/img/2024/04/04/1743165-894849-615x345.jpg
/en/news-in-english/19/2244592/it-was-the-right-decision-how-lithuania-impeached-its-president-20-years-ago,‘It was the right decision’. How Lithuania impeached its president 20 years ago,/img/2021/04/09/901532-806458-615x345.jpg
/en/news-in-english/19/2242416/lrt-english-newsletter-mood-swings,LRT English Newsletter: Mood swings,/img/2024/03/30/1740533-306101-615x345.jpg
/en/news-in-english/19/2241229/our-border-is-also-with-russia-interview-with-dutch-pm,‘Our border is also with Russia’ – interview with Dutch PM,/img/2024/04/02/1741900-794115-615x345.jpg
/en/news-in-english/19/2240493/it-s-not-for-everyone-getting-into-orka-lithuania-s-elite-special-force,"‘It’s not for everyone’: getting into ORKA, Lithuania’s elite special force",/img/2024/03/31/1740740-735266-615x345.jpg
