url,headline,img_path
/en/news-in-english/19/2242991/disgrace-or-heritage-a-unique-district-dubbed-shanghai-of-vilnius,Disgrace or heritage? A unique district dubbed Shanghai of Vilnius,/img/2024/04/03/1742604-758386-150x84.jpg
/en/news-in-english/19/2241491/lithuania-s-only-amsterdam-school-style-building-in-kaunas-houses-uique-museum,Lithuania’s only Amsterdam School-style building in Kaunas houses uique museum,/img/2024/03/28/1739092-350642-150x84.jpg
/en/news-in-english/19/2243302/rubbish-province-of-russia-vilnius-residents-slam-new-tourism-promotion-campaign,‘Rubbish province of Russia’: Vilnius residents slam new tourism promotion campaign,/img/2024/04/05/1744212-845338-150x84.jpg
/en/news-in-english/19/2243274/lithuanian-court-deems-ex-president-s-donor-threat-to-national-security,Lithuanian court deems ex-president’s donor threat to national security,/img/2019/05/20/432673-181809-150x84.jpg
/en/news-in-english/19/2243131/western-instructors-could-go-to-ukraine-under-proper-air-defence-lithuanian-pm,Western instructors could go to Ukraine under proper air defence – Lithuanian PM,/img/2024/04/05/1744055-728004-150x84.jpg
/en/news-in-english/19/2243106/lithuanian-ministry-tables-bill-to-bolster-defence-industry,Lithuanian ministry tables bill to bolster defence industry,/img/2024/03/26/1736002-712920-150x84.jpg
/en/news-in-english/19/2242998/lithuania-to-buy-3-000-drones-for-ukraine-launches-soldiers-rehabilitation-initiative,"Lithuania to buy 3,000 drones for Ukraine, launches soldiers’ rehabilitation initiative",/img/2023/12/15/1662441-133351-150x84.jpg
/en/news-in-english/19/2242901/incumbent-nauseda-strongly-leads-presidential-opinion-polls-in-lithuania,Incumbent Nausėda strongly leads presidential opinion polls in Lithuania,/img/2024/03/28/1738402-837301-150x84.jpg
/en/news-in-english/19/2242416/lrt-english-newsletter-mood-swings,LRT English Newsletter: Mood swings,/img/2024/03/30/1740533-306101-150x84.jpg
/en/news-in-english/19/2242189/new-campaign-invites-brits-germans-to-break-stereotypes-about-vilnius,"New campaign invites Brits, Germans to break stereotypes about Vilnius",/img/2024/04/04/1743165-894849-150x84.jpg
/en/news-in-english/19/2242150/nauseda-simonyte-zalimas-registered-as-presidential-candidates-in-lithuania,"Nausėda, Šimonytė, Žalimas registered as presidential candidates in Lithuania",/img/2023/03/07/1463498-275493-150x84.jpg
/en/news-in-english/19/2242086/biggest-battles-may-lie-ahead-lithuania-s-fm-on-nato-anniversary,Biggest battles may lie ahead – Lithuania’s FM on NATO anniversary,/img/2024/03/29/1739950-194397-150x84.jpg
/en/news-in-english/19/2241962/lithuania-mulls-banning-chinese-software-in-private-power-plants-minister,Lithuania mulls banning Chinese software in private power plants – minister,/img/2019/07/26/480414-694414-150x84.jpg
/en/news-in-english/19/2241912/german-troops-to-start-coming-to-lithuania-next-week-ministry,German troops to start coming to Lithuania next week – ministry,/img/2023/12/07/1656452-682971-150x84.jpg
/en/news-in-english/19/2241229/our-border-is-also-with-russia-interview-with-dutch-pm,‘Our border is also with Russia’ – interview with Dutch PM,/img/2024/04/02/1741900-794115-150x84.jpg
/en/news-in-english/19/2241549/two-lithuanian-mps-targeted-by-decade-long-chinese-hacker-campaign,Two Lithuanian MPs targeted by decade-long Chinese hacker campaign,/img/2022/07/05/1296986-468896-150x84.jpg
/en/news-in-english/19/2242991/disgrace-or-heritage-a-unique-district-dubbed-shanghai-of-vilnius,Disgrace or heritage? A unique district dubbed Shanghai of Vilnius,
/en/news-in-english/19/2241491/lithuania-s-only-amsterdam-school-style-building-in-kaunas-houses-uique-museum,Lithuania’s only Amsterdam School-style building in Kaunas houses uique museum,
/en/news-in-english/19/2243302/rubbish-province-of-russia-vilnius-residents-slam-new-tourism-promotion-campaign,‘Rubbish province of Russia’: Vilnius residents slam new tourism promotion campaign,/img/2024/04/05/1744212-845338-393x221.jpg
/en/news-in-english/19/2243274/lithuanian-court-deems-ex-president-s-donor-threat-to-national-security,Lithuanian court deems ex-president’s donor threat to national security,/img/2019/05/20/432673-181809-393x221.jpg
/en/news-in-english/19/2243131/western-instructors-could-go-to-ukraine-under-proper-air-defence-lithuanian-pm,Western instructors could go to Ukraine under proper air defence – Lithuanian PM,/img/2024/04/05/1744055-728004-393x221.jpg
/en/news-in-english/19/2243274/lithuanian-court-deems-ex-president-s-donor-threat-to-national-security,Lithuanian court deems ex-president’s donor threat to national security,/img/2019/05/20/432673-181809-615x345.jpg
/en/news-in-english/19/2243131/western-instructors-could-go-to-ukraine-under-proper-air-defence-lithuanian-pm,Western instructors could go to Ukraine under proper air defence – Lithuanian PM,/img/2024/04/05/1744055-728004-393x221.jpg
/en/news-in-english/19/2243106/lithuanian-ministry-tables-bill-to-bolster-defence-industry,Lithuanian ministry tables bill to bolster defence industry,/img/2024/03/26/1736002-712920-393x221.jpg
/en/news-in-english/19/2242998/lithuania-to-buy-3-000-drones-for-ukraine-launches-soldiers-rehabilitation-initiative,"Lithuania to buy 3,000 drones for Ukraine, launches soldiers’ rehabilitation initiative",/img/2023/12/15/1662441-133351-393x221.jpg
/en/news-in-english/19/2242901/incumbent-nauseda-strongly-leads-presidential-opinion-polls-in-lithuania,Incumbent Nausėda strongly leads presidential opinion polls in Lithuania,/img/2024/03/28/1738402-837301-393x221.jpg
/en/news-in-english/19/2233999/belarusians-celebrated-freedom-day-in-vilnius-hoping-to-one-day-do-it-in-minsk,"Belarusians celebrated Freedom Day in Vilnius, hoping to one day do it in Minsk",/img/2024/03/25/1735544-749958-615x345.jpg
/en/news-in-english/19/2229382/funds-from-frozen-russian-assets-could-reach-ukraine-in-july-eu-commissioner,Funds from frozen Russian assets could reach Ukraine in July – EU commissioner,/img/2024/02/26/1713076-124391-615x345.jpg
/en/news-in-english/19/2229342/there-are-no-litvinist-groups-among-belarusian-diaspora-intelligence,There are no Litvinist groups among Belarusian diaspora – intelligence,/img/2024/03/07/1721370-510533-615x345.jpg
/en/news-in-english/19/2226498/lithuania-s-fm-slams-russian-election-as-tragic-farce,Lithuania’s FM slams Russian election as ‘tragic farce’,/img/2024/03/13/1725607-555391-615x345.jpg
/en/news-in-english/19/2242991/disgrace-or-heritage-a-unique-district-dubbed-shanghai-of-vilnius,Disgrace or heritage? A unique district dubbed Shanghai of Vilnius,/img/2024/04/03/1742604-758386-615x345.jpg
/en/news-in-english/19/2241962/lithuania-mulls-banning-chinese-software-in-private-power-plants-minister,Lithuania mulls banning Chinese software in private power plants – minister,/img/2019/07/26/480414-694414-615x345.jpg
/en/news-in-english/19/2241355/lithuania-s-2023-budget-deficit-much-smaller-than-planned,Lithuania’s 2023 budget deficit much smaller than planned,/img/2019/10/22/535688-242602-615x345.jpg
/en/news-in-english/19/2241340/wizz-air-cancels-six-flights-from-lithuania,Wizz Air cancels six flights from Lithuania,/img/2021/08/10/1028706-543749-615x345.jpg
/en/news-in-english/19/2241491/lithuania-s-only-amsterdam-school-style-building-in-kaunas-houses-uique-museum,Lithuania’s only Amsterdam School-style building in Kaunas houses uique museum,/img/2024/03/28/1739092-350642-615x345.jpg
/en/news-in-english/19/2243302/rubbish-province-of-russia-vilnius-residents-slam-new-tourism-promotion-campaign,‘Rubbish province of Russia’: Vilnius residents slam new tourism promotion campaign,/img/2024/04/05/1744212-845338-615x345.jpg
/en/news-in-english/19/2242189/new-campaign-invites-brits-germans-to-break-stereotypes-about-vilnius,"New campaign invites Brits, Germans to break stereotypes about Vilnius",/img/2024/04/04/1743165-894849-615x345.jpg
/en/news-in-english/19/2241470/number-of-ukrainians-declines-in-lithuania-migration-from-central-asia-on-steep-rise,"Number of Ukrainians declines in Lithuania, migration from Central Asia on steep rise",/img/2024/04/02/1741444-4181-615x345.jpg
/en/news-in-english/19/2242416/lrt-english-newsletter-mood-swings,LRT English Newsletter: Mood swings,/img/2024/03/30/1740533-306101-615x345.jpg
/en/news-in-english/19/2241229/our-border-is-also-with-russia-interview-with-dutch-pm,‘Our border is also with Russia’ – interview with Dutch PM,/img/2024/04/02/1741900-794115-615x345.jpg
/en/news-in-english/19/2240493/it-s-not-for-everyone-getting-into-orka-lithuania-s-elite-special-force,"‘It’s not for everyone’: getting into ORKA, Lithuania’s elite special force",/img/2024/03/31/1740740-735266-615x345.jpg
/en/news-in-english/19/2238006/red-line-and-turning-point-lithuania-s-path-to-joining-nato-20-years-ago,Red line and turning point – Lithuania’s path to joining NATO 20 years ago,/img/2022/11/22/1389294-157438-615x345.jpg
