url,headline,img_path
/en/news-in-english/19/2400518/lithuania-set-to-certify-first-of-its-kind-drone-traffic-management-app-in-europe,Lithuania set to certify ‘first of its kind’ drone traffic management app in Europe,/img/2024/05/20/1777680-13492-150x84.jpg
/en/news-in-english/19/2400432/lithuania-issues-defence-bonds-worth-eur9m,Lithuania issues defence bonds worth €9m,/img/2023/11/30/1651165-768184-150x84.jpg
/en/news-in-english/19/2400272/lithuania-urges-more-nato-aid-to-ukraine-as-north-korean-troops-train-in-russia,Lithuania urges more NATO aid to Ukraine as North Korean troops train in Russia,/img/2024/10/25/1897390-655919-150x84.jpg
/en/news-in-english/19/2400257/quarter-of-smokers-in-lithuania-buy-illicit-cigarettes,Quarter of smokers in Lithuania buy illicit cigarettes,/img/2021/04/15/924331-122648-150x84.jpg
/en/news-in-english/19/2399532/industrial-tourism-lithuanians-swapping-museums-for-factories,Industrial tourism: Lithuanians swapping museums for factories,/img/2024/10/28/1900074-630360-150x84.jpg
/en/news-in-english/19/2399261/first-north-korean-troops-killed-in-russia-says-lithuanian-source,"First North Korean troops killed in Russia, says Lithuanian source",/img/2024/10/27/1899112-611255-150x84.jpg
/en/news-in-english/19/2399681/morkunaite-mikuleniene-named-interim-chair-of-ts-lkd-after-landsbergis-resignation,Morkūnaitė-Mikulėnienė named interim chair of TS-LKD after Landsbergis’ resignation,/img/2024/09/15/1858083-848734-150x84.jpg
/en/news-in-english/19/2399606/nato-must-respond-not-just-with-statements-to-north-koreans-in-kursk-lithuanian-rep,NATO must respond ‘not just with statements’ to North Koreans in Kursk – Lithuanian rep,/img/2024/10/16/1886067-942564-150x84.jpg
/en/news-in-english/19/2399208/lithuania-s-parliament-elections-key-takeaways,Lithuania’s parliament elections: key takeaways,/img/2024/10/28/1899594-74374-150x84.jpg
/en/news-in-english/19/2399332/dia-de-los-muertos-in-vilnius-photos,Día de los Muertos in Vilnius – photos,/img/2024/10/28/1899844-974489-150x84.jpg
/en/news-in-english/19/2399206/lithuanian-social-democratic-leader-hails-historic-election-victory,Lithuanian Social Democratic leader hails ‘historic’ election victory,/img/2024/10/28/1899596-193479-150x84.jpg
/en/news-in-english/19/2399029/landsbergis-steps-down-as-conservative-leader-refuses-seimas-seat,"Landsbergis steps down as conservative leader, refuses Seimas seat",/img/2024/10/28/1899611-266898-150x84.jpg
/en/news-in-english/19/2399016/lithuanian-leaders-no-longer-expect-pro-western-course-in-georgia,Lithuanian leaders no longer expect pro-Western course in Georgia,/img/2024/10/27/1898888-994063-150x84.jpg
/en/news-in-english/19/2396867/northern-lithuanian-town-looks-to-attract-workers-with-eur6-000-bonuses,"Northern Lithuanian town looks to attract workers with €6,000 bonuses",/img/2024/07/12/1815959-580988-150x84.jpg
/en/news-in-english/19/2398287/lithuania-s-parliamentary-run-offs-social-democrats-seal-victory-with-52-seats,Lithuania’s parliamentary run-offs: Social Democrats seal victory with 52 seats,/img/2024/10/27/1899343-459534-150x84.jpg
/en/news-in-english/19/2386128/from-the-archives-the-biggest-storms-to-hit-lithuania,From the archives: The biggest storms to hit Lithuania,/img/2024/10/14/1883946-91302-150x84.png
/en/news-in-english/19/2399532/industrial-tourism-lithuanians-swapping-museums-for-factories,Industrial tourism: Lithuanians swapping museums for factories,
/en/news-in-english/19/2400272/lithuania-urges-more-nato-aid-to-ukraine-as-north-korean-troops-train-in-russia,Lithuania urges more NATO aid to Ukraine as North Korean troops train in Russia,
/en/news-in-english/19/2400518/lithuania-set-to-certify-first-of-its-kind-drone-traffic-management-app-in-europe,Lithuania set to certify ‘first of its kind’ drone traffic management app in Europe,/img/2024/05/20/1777680-13492-393x221.jpg
/en/news-in-english/19/2400432/lithuania-issues-defence-bonds-worth-eur9m,Lithuania issues defence bonds worth €9m,/img/2023/11/30/1651165-768184-393x221.jpg
/en/news-in-english/19/2400257/quarter-of-smokers-in-lithuania-buy-illicit-cigarettes,Quarter of smokers in Lithuania buy illicit cigarettes,/img/2021/04/15/924331-122648-393x221.jpg
/en/news-in-english/19/2400518/lithuania-set-to-certify-first-of-its-kind-drone-traffic-management-app-in-europe,Lithuania set to certify ‘first of its kind’ drone traffic management app in Europe,/img/2024/05/20/1777680-13492-615x345.jpg
/en/news-in-english/19/2400432/lithuania-issues-defence-bonds-worth-eur9m,Lithuania issues defence bonds worth €9m,/img/2023/11/30/1651165-768184-393x221.jpg
/en/news-in-english/19/2400272/lithuania-urges-more-nato-aid-to-ukraine-as-north-korean-troops-train-in-russia,Lithuania urges more NATO aid to Ukraine as North Korean troops train in Russia,/img/2024/10/25/1897390-655919-393x221.jpg
/en/news-in-english/19/2399681/morkunaite-mikuleniene-named-interim-chair-of-ts-lkd-after-landsbergis-resignation,Morkūnaitė-Mikulėnienė named interim chair of TS-LKD after Landsbergis’ resignation,/img/2024/09/15/1858083-848734-393x221.jpg
/en/news-in-english/19/2399606/nato-must-respond-not-just-with-statements-to-north-koreans-in-kursk-lithuanian-rep,NATO must respond ‘not just with statements’ to North Koreans in Kursk – Lithuanian rep,/img/2024/10/16/1886067-942564-393x221.jpg
/en/news-in-english/19/2399261/first-north-korean-troops-killed-in-russia-says-lithuanian-source,"First North Korean troops killed in Russia, says Lithuanian source",/img/2024/10/27/1899112-611255-615x345.jpg
/en/news-in-english/19/2394398/lithuanian-led-cyber-response-team-deployed-in-moldova-during-election,Lithuanian-led cyber response team deployed in Moldova during election,/img/2024/10/20/1889756-857892-615x345.jpg
/en/news-in-english/19/2391791/lithuanian-fm-calls-to-investigate-alleged-russian-interference-in-moldovan-referendum,Lithuanian FM calls to investigate alleged Russian interference in Moldovan referendum,/img/2024/08/27/1844772-442911-615x345.jpg
/en/news-in-english/19/2391537/ukraine-parliament-speaker-expects-continued-support-in-lithuania-s-next-seimas,Ukraine parliament speaker expects continued support in Lithuania’s next Seimas,/img/2022/12/08/1402647-613461-615x345.jpg
/en/news-in-english/19/2400432/lithuania-issues-defence-bonds-worth-eur9m,Lithuania issues defence bonds worth €9m,/img/2023/11/30/1651165-768184-615x345.jpg
/en/news-in-english/19/2400257/quarter-of-smokers-in-lithuania-buy-illicit-cigarettes,Quarter of smokers in Lithuania buy illicit cigarettes,/img/2021/04/15/924331-122648-615x345.jpg
/en/news-in-english/19/2399532/industrial-tourism-lithuanians-swapping-museums-for-factories,Industrial tourism: Lithuanians swapping museums for factories,/img/2024/10/28/1900074-630360-615x345.jpg
/en/news-in-english/19/2396867/northern-lithuanian-town-looks-to-attract-workers-with-eur6-000-bonuses,"Northern Lithuanian town looks to attract workers with €6,000 bonuses",/img/2024/07/12/1815959-580988-615x345.jpg
/en/news-in-english/19/2399332/dia-de-los-muertos-in-vilnius-photos,Día de los Muertos in Vilnius – photos,/img/2024/10/28/1899844-974489-615x345.jpg
/en/news-in-english/19/2394517/kaunas-library-discovers-unique-17-century-book,Kaunas library discovers unique 17-century book,/img/2024/10/22/1890799-380334-615x345.jpg
/en/news-in-english/19/2396168/vilnius-born-global-portal-network-expands-to-philadelphia,Vilnius-born global Portal network expands to Philadelphia,/img/2024/10/24/1896541-998486-615x345.jpg
/en/news-in-english/19/2392518/how-long-will-we-keep-seeing-northern-lights-over-lithuania,How long will we keep seeing Northern Lights over Lithuania?,/img/2024/10/11/1881214-95102-615x345.jpg
/en/news-in-english/19/2386128/from-the-archives-the-biggest-storms-to-hit-lithuania,From the archives: The biggest storms to hit Lithuania,/img/2024/10/14/1883946-91302-615x345.png
/en/news-in-english/19/2396212/lrt-english-newsletter-going-with-a-bang,LRT English Newsletter: Going with a bang,/img/2024/10/24/1896585-82737-615x345.jpg
/en/news-in-english/19/2387118/in-its-reelection-campaign-georgia-s-ruling-party-plays-the-ukraine-war-card,"In its reelection campaign, Georgia’s ruling party plays the Ukraine war card",/img/2024/10/23/1892698-142177-615x345.jpg
/en/news-in-english/19/2394986/when-germany-sneezes-lithuanian-manufacturers-hit-by-recession-in-major-export-market,When Germany sneezes: Lithuanian manufacturers hit by recession in major export market,/img/2024/10/10/1880356-581113-615x345.jpg
