url,headline,img_path
/en/news-in-english/19/2328781/latvia-asks-lithuania-s-assistance-in-policing-its-border-with-belarus,Latvia asks Lithuania’s assistance in policing its border with Belarus,/img/2021/08/16/1032505-200110-150x84.jpg
/en/news-in-english/19/2328625/lithuania-s-mod-presents-fortifications-plan-focus-on-mines-and-counter-mobility-parks,Lithuania’s MoD presents fortifications plan: focus on mines and counter-mobility parks,/img/2024/07/08/1812600-958739-150x84.jpg
/en/news-in-english/19/2328572/lithuania-will-conduct-enhanced-checks-of-non-eu-trucks-on-latvian-border,Lithuania will conduct enhanced checks of non-EU trucks on Latvian border,/img/2022/04/11/1235867-209623-150x84.jpg
/en/news-in-english/19/2328491/fallen-tree-kills-man-in-vilnius,Fallen tree kills man in Vilnius,/img/2024/07/29/1826281-306566-150x84.jpg
/en/news-in-english/19/2328452/storm-disrupts-flights-and-trains-throughout-lithuania,Storm disrupts flights and trains throughout Lithuania,/img/2024/07/29/1826433-113125-150x84.jpg
/en/news-in-english/19/2328410/poland-to-let-security-forces-use-arms-with-impunity-activists-bemoan-license-to-kill,"Poland to let security forces use arms with impunity, activists bemoan ‘license to kill’",/img/2024/05/24/1781067-275246-150x84.jpg
/en/news-in-english/19/2328400/no-suspects-yet-in-vilnius-nato-summit-leak-probe,No suspects yet in Vilnius NATO summit leak probe,/img/2023/07/14/1550907-734569-150x84.jpg
/en/news-in-english/19/2328336/israeli-president-isaac-herzog-to-visit-lithuania,Israeli President Isaac Herzog to visit Lithuania,/img/2023/03/27/1478345-416716-150x84.jpg
/en/news-in-english/19/2328244/lithuania-pounded-by-massive-storm,Lithuania pounded by massive storm,/img/2024/07/29/1826350-18665-150x84.jpg
/en/news-in-english/19/2316442/russian-media-exiles-get-a-hard-landing-in-the-baltics,Russian media exiles get a hard landing in the Baltics,/img/2024/07/11/1815315-870983-150x84.jpg
/en/news-in-english/19/2325666/housing-affordability-in-lithuania-still-below-pre-pandemic-levels-what-can-be-done,Housing affordability in Lithuania still below pre-pandemic levels – what can be done?,/img/2024/07/05/1810861-253459-150x84.jpg
/en/news-in-english/19/2326965/mcdonald-s-tops-lithuania-s-highest-grossing-restaurant-chain-list,McDonald's tops Lithuania's highest-grossing restaurant chain list,/img/2020/04/03/631022-705021-150x84.jpg
/en/news-in-english/19/2327351/lithuanian-eu-committee-chairs-slam-orban-s-moscow-visit,"Lithuanian, EU committee chairs slam Orbán’s Moscow visit",/img/2024/07/05/1810712-687050-150x84.jpg
/en/news-in-english/19/2327303/as-lithuania-s-dual-citizenship-referendum-fumbled-one-proposal-is-to-ignore-the-law,"As Lithuania’s dual citizenship referendum fumbled, one proposal is... to ignore the law",/img/2024/07/03/1809236-817780-150x84.jpg
/en/news-in-english/19/2327150/lithuania-looking-for-safest-site-for-spent-nuclear-fuel-repository,Lithuania looking for ‘safest site’ for spent nuclear fuel repository,/img/2024/06/18/1800430-939541-150x84.jpg
/en/news-in-english/19/2327057/ukraine-s-security-busts-saboteur-group-that-planned-attacks-in-baltics,Ukraine’s security busts saboteur group that planned attacks in Baltics,/img/2019/12/12/566838-459158-150x84.jpg
/en/news-in-english/19/2316442/russian-media-exiles-get-a-hard-landing-in-the-baltics,Russian media exiles get a hard landing in the Baltics,
/en/news-in-english/19/2328491/fallen-tree-kills-man-in-vilnius,Fallen tree kills man in Vilnius,
/en/news-in-english/19/2328244/lithuania-pounded-by-massive-storm,Lithuania pounded by massive storm,/img/2024/07/29/1826350-18665-393x221.jpg
/en/news-in-english/19/2328781/latvia-asks-lithuania-s-assistance-in-policing-its-border-with-belarus,Latvia asks Lithuania’s assistance in policing its border with Belarus,/img/2021/08/16/1032505-200110-393x221.jpg
/en/news-in-english/19/2328625/lithuania-s-mod-presents-fortifications-plan-focus-on-mines-and-counter-mobility-parks,Lithuania’s MoD presents fortifications plan: focus on mines and counter-mobility parks,/img/2024/07/08/1812600-958739-393x221.jpg
/en/news-in-english/19/2328781/latvia-asks-lithuania-s-assistance-in-policing-its-border-with-belarus,Latvia asks Lithuania’s assistance in policing its border with Belarus,/img/2021/08/16/1032505-200110-615x345.jpg
/en/news-in-english/19/2328625/lithuania-s-mod-presents-fortifications-plan-focus-on-mines-and-counter-mobility-parks,Lithuania’s MoD presents fortifications plan: focus on mines and counter-mobility parks,/img/2024/07/08/1812600-958739-393x221.jpg
/en/news-in-english/19/2328491/fallen-tree-kills-man-in-vilnius,Fallen tree kills man in Vilnius,/img/2024/07/29/1826281-306566-393x221.jpg
/en/news-in-english/19/2328452/storm-disrupts-flights-and-trains-throughout-lithuania,Storm disrupts flights and trains throughout Lithuania,/img/2024/07/29/1826433-113125-393x221.jpg
/en/news-in-english/19/2328400/no-suspects-yet-in-vilnius-nato-summit-leak-probe,No suspects yet in Vilnius NATO summit leak probe,/img/2023/07/14/1550907-734569-393x221.jpg
/en/news-in-english/19/2328410/poland-to-let-security-forces-use-arms-with-impunity-activists-bemoan-license-to-kill,"Poland to let security forces use arms with impunity, activists bemoan ‘license to kill’",/img/2024/05/24/1781067-275246-615x345.jpg
/en/news-in-english/19/2321751/lithuania-turns-away-belarus-registered-cars-as-eu-ban-enters-into-force,Lithuania turns away Belarus-registered cars as EU ban enters into force,/img/2024/07/18/1819917-473009-615x345.jpg
/en/news-in-english/19/2321234/belarus-claims-it-detained-lithuanian-murder-suspect,Belarus claims it detained Lithuanian murder suspect,/img/2024/01/23/1686971-202187-615x345.jpg
/en/news-in-english/19/2321146/lithuania-enforces-eu-ban-on-belarus-registered-cars,Lithuania enforces EU ban on Belarus-registered cars,/img/2024/03/01/1716808-508130-615x345.jpg
/en/news-in-english/19/2328572/lithuania-will-conduct-enhanced-checks-of-non-eu-trucks-on-latvian-border,Lithuania will conduct enhanced checks of non-EU trucks on Latvian border,/img/2022/04/11/1235867-209623-615x345.jpg
/en/news-in-english/19/2325666/housing-affordability-in-lithuania-still-below-pre-pandemic-levels-what-can-be-done,Housing affordability in Lithuania still below pre-pandemic levels – what can be done?,/img/2024/07/05/1810861-253459-615x345.jpg
/en/news-in-english/19/2326965/mcdonald-s-tops-lithuania-s-highest-grossing-restaurant-chain-list,McDonald's tops Lithuania's highest-grossing restaurant chain list,/img/2020/04/03/631022-705021-615x345.jpg
/en/news-in-english/19/2327150/lithuania-looking-for-safest-site-for-spent-nuclear-fuel-repository,Lithuania looking for ‘safest site’ for spent nuclear fuel repository,/img/2024/06/18/1800430-939541-615x345.jpg
/en/news-in-english/19/2327303/as-lithuania-s-dual-citizenship-referendum-fumbled-one-proposal-is-to-ignore-the-law,"As Lithuania’s dual citizenship referendum fumbled, one proposal is... to ignore the law",/img/2024/07/03/1809236-817780-615x345.jpg
/en/news-in-english/19/2325514/meet-lithuania-s-top-competitors-at-the-paris-olympic-games,Meet Lithuania's top competitors at the Paris Olympic Games,/img/2024/07/24/1823017-611638-615x345.jpg
/en/news-in-english/19/2326612/lithuanian-olympic-and-paralympic-athletes-get-ready-for-paris-2024,Lithuanian Olympic and Paralympic athletes get ready for Paris 2024,/img/2024/07/22/1821863-46149-615x345.jpg
/en/news-in-english/19/2326518/lithuania-is-drawing-up-evacuation-plan-in-case-of-war,Lithuania is drawing up evacuation plan in case of war,/img/2022/05/04/1252280-530584-615x345.jpg
/en/news-in-english/19/2316442/russian-media-exiles-get-a-hard-landing-in-the-baltics,Russian media exiles get a hard landing in the Baltics,/img/2024/07/11/1815315-870983-615x345.jpg
/en/news-in-english/19/2326770/lrt-english-newsletter-summertime-but-the-living-ain-t-easy,LRT English Newsletter: Summertime but the living ain’t easy,/img/2024/07/13/1817431-744310-615x345.jpg
/en/news-in-english/19/2326381/nato-finds-gaping-holes-in-europe-s-defences,NATO finds gaping holes in Europe’s defences,/img/2024/03/25/1735003-100920-615x345.jpg
/en/news-in-english/19/2325873/why-some-ukrainians-may-face-deportation-from-lithuania,Why some Ukrainians may face deportation from Lithuania?,/img/2022/10/10/1360325-556128-615x345.jpg
