url,headline,img_path
/en/news-in-english/19/2606265/unexploded-ordnance-found-at-reconstruction-site-in-klaipeda,Unexploded ordnance found at reconstruction site in Klaipėda,/img/2024/10/01/1872240-257407-150x84.jpg
/en/news-in-english/19/2606202/bbc-spotlights-lithuanian-space-tech-start-up-astrolight,BBC spotlights Lithuanian space-tech start-up Astrolight,/img/2021/07/20/1014362-901238-150x84.jpg
/en/news-in-english/19/2606255/lithuania-increases-charter-flights-to-tel-aviv-amid-growing-demand,Lithuania increases charter flights to Tel Aviv amid growing demand,/img/2025/06/13/2098386-129258-150x84.jpg
/en/news-in-english/19/2606237/lithuanian-dancer-discovered-dead-after-going-missing-in-dubai,Lithuanian dancer discovered dead after going missing in Dubai,/img/2025/07/11/2127443-7005-150x84.jpg
/en/news-in-english/19/2606208/there-will-be-no-third-referendum-on-dual-citizenship-lithuanian-world-community-chair,There will be no third referendum on dual citizenship – Lithuanian World Community chair,/img/2024/07/03/1808914-51136-150x84.jpg
/en/news-in-english/19/2606135/lithuania-s-grazulis-and-tomaszewski-among-meps-who-voted-to-oust-von-der-leyen,Lithuania's Gražulis and Tomaszewski among MEPs who voted to oust von der Leyen,/img/2025/07/09/2124850-995088-150x84.jpg
/en/news-in-english/19/2606122/russian-drone-crashed-in-lithuania-what-you-should-know,Russian drone crashed in Lithuania – what you should know,/img/2025/07/10/2126054-564689-150x84.jpg
/en/news-in-english/19/2606099/conservatives-push-out-social-democrats-at-the-top-of-lithuanian-party-rankings-poll,Conservatives push out Social Democrats at the top of Lithuanian party rankings – poll,/img/2024/10/27/1899204-478652-150x84.jpg
/en/news-in-english/19/2606050/lithuanian-fm-says-he-has-good-feeling-after-ukraine-reconstruction-conference,Lithuanian FM says he has good feeling after Ukraine reconstruction conference,/img/2025/07/11/2127191-967211-150x84.jpg
/en/news-in-english/19/2605866/amid-debate-on-russian-language-in-vilnius-minister-urges-more-effort-to-teach-lithuanian,"Amid debate on Russian language in Vilnius, minister urges more effort to teach Lithuanian",/img/2025/06/09/2094240-873916-150x84.jpg
/en/news-in-english/19/2605868/lrt-english-newsletter-dominoes-and-drones,LRT English Newsletter: Dominoes and drones,/img/2025/07/10/2126485-347670-150x84.jpg
/en/news-in-english/19/2605872/lithuanian-fm-scolds-slovakia-s-veto-on-further-russia-sanctions,Lithuanian FM scolds Slovakia’s veto on further Russia sanctions,/img/2025/07/01/2116180-338707-150x84.jpg
/en/news-in-english/19/2605860/lithuanian-military-investigates-airspace-intrusion-by-flying-object-from-belarus,Lithuanian military investigates airspace intrusion by flying object from Belarus,/img/2025/07/10/2126426-166818-150x84.png
/en/news-in-english/19/2605852/vilnius-buys-73-new-trolleybuses-from-poland-s-solaris,Vilnius buys 73 new trolleybuses from Poland’s Solaris,/img/2024/08/22/1841852-220315-150x84.jpg
/en/news-in-english/19/2605771/former-lithuanian-mp-sentenced-to-7-years-for-sex-crimes-against-minors,Former Lithuanian MP sentenced to 7 years for sex crimes against minors,/img/2025/07/10/2126168-522099-150x84.jpg
/en/news-in-english/19/2605741/police-chase-near-lithuanian-polish-border-leads-to-shootout-suspect-dies-in-car-fire,"Police chase near Lithuanian-Polish border leads to shootout, suspect dies in car fire",/img/2025/07/10/2126059-128003-150x84.jpg
/en/news-in-english/19/2606122/russian-drone-crashed-in-lithuania-what-you-should-know,Russian drone crashed in Lithuania – what you should know,
/en/news-in-english/19/2606202/bbc-spotlights-lithuanian-space-tech-start-up-astrolight,BBC spotlights Lithuanian space-tech start-up Astrolight,
/en/news-in-english/19/2606265/unexploded-ordnance-found-at-reconstruction-site-in-klaipeda,Unexploded ordnance found at reconstruction site in Klaipėda,/img/2024/10/01/1872240-257407-393x221.jpg
/en/news-in-english/19/2606255/lithuania-increases-charter-flights-to-tel-aviv-amid-growing-demand,Lithuania increases charter flights to Tel Aviv amid growing demand,/img/2025/06/13/2098386-129258-393x221.jpg
/en/news-in-english/19/2606237/lithuanian-dancer-discovered-dead-after-going-missing-in-dubai,Lithuanian dancer discovered dead after going missing in Dubai,/img/2025/07/11/2127443-7005-393x221.jpg
/en/news-in-english/19/2606237/lithuanian-dancer-discovered-dead-after-going-missing-in-dubai,Lithuanian dancer discovered dead after going missing in Dubai,/img/2025/07/11/2127443-7005-615x345.jpg
/en/news-in-english/19/2606135/lithuania-s-grazulis-and-tomaszewski-among-meps-who-voted-to-oust-von-der-leyen,Lithuania's Gražulis and Tomaszewski among MEPs who voted to oust von der Leyen,/img/2025/07/09/2124850-995088-393x221.jpg
/en/news-in-english/19/2606122/russian-drone-crashed-in-lithuania-what-you-should-know,Russian drone crashed in Lithuania – what you should know,/img/2025/07/10/2126054-564689-393x221.jpg
/en/news-in-english/19/2606099/conservatives-push-out-social-democrats-at-the-top-of-lithuanian-party-rankings-poll,Conservatives push out Social Democrats at the top of Lithuanian party rankings – poll,/img/2024/10/27/1899204-478652-393x221.jpg
/en/news-in-english/19/2605860/lithuanian-military-investigates-airspace-intrusion-by-flying-object-from-belarus,Lithuanian military investigates airspace intrusion by flying object from Belarus,/img/2025/07/10/2126426-166818-393x221.png
/en/news-in-english/19/2605251/lavrov-s-foreword-to-false-lithuanian-history-it-s-a-warning-sign-says-swedish-analyst,"Lavrov’s foreword to false Lithuanian history: it's a warning sign, says Swedish analyst",/img/2025/07/01/2116449-319866-615x345.jpg
/en/news-in-english/19/2604879/the-tsikhanouski-story-could-his-release-split-the-belarusian-opposition,The Tsikhanouski story: could his release split the Belarusian opposition?,/img/2025/06/22/2109573-649016-615x345.jpg
/en/news-in-english/19/2605352/lithuania-to-contribute-eur1m-to-the-ec-s-ukraine-reconstruction-programme,Lithuania to contribute €1m to the EC’s Ukraine reconstruction programme,/img/2025/07/09/2124312-452239-615x345.jpg
/en/news-in-english/19/2604517/a-journalist-in-jail-freed-former-rfe-rl-reporter-recalls-belarus-prison-ordeal,A journalist in jail: freed former RFE/RL reporter recalls Belarus prison ordeal,/img/2025/07/07/2122622-479804-615x345.jpg
/en/news-in-english/19/2606255/lithuania-increases-charter-flights-to-tel-aviv-amid-growing-demand,Lithuania increases charter flights to Tel Aviv amid growing demand,/img/2025/06/13/2098386-129258-615x345.jpg
/en/news-in-english/19/2605852/vilnius-buys-73-new-trolleybuses-from-poland-s-solaris,Vilnius buys 73 new trolleybuses from Poland’s Solaris,/img/2024/08/22/1841852-220315-615x345.jpg
/en/news-in-english/19/2605183/lithuania-to-allocate-eur10-5m-for-development-aid,Lithuania to allocate €10.5m for development aid,/img/2020/05/25/658745-20512-615x345.jpg
/en/news-in-english/19/2604853/as-housing-market-heats-up-lithuania-s-central-bank-seeks-ways-to-help-first-time-buyers,"As housing market heats up, Lithuania’s central bank seeks ways to help first-time buyers",/img/2025/04/04/2036907-425231-615x345.jpg
/en/news-in-english/19/2606265/unexploded-ordnance-found-at-reconstruction-site-in-klaipeda,Unexploded ordnance found at reconstruction site in Klaipėda,/img/2024/10/01/1872240-257407-615x345.jpg
/en/news-in-english/19/2606208/there-will-be-no-third-referendum-on-dual-citizenship-lithuanian-world-community-chair,There will be no third referendum on dual citizenship – Lithuanian World Community chair,/img/2024/07/03/1808914-51136-615x345.jpg
/en/news-in-english/19/2605866/amid-debate-on-russian-language-in-vilnius-minister-urges-more-effort-to-teach-lithuanian,"Amid debate on Russian language in Vilnius, minister urges more effort to teach Lithuanian",/img/2025/06/09/2094240-873916-615x345.jpg
/en/news-in-english/19/2605384/lithuanian-adventurer-set-out-to-run-across-australia-but-then-got-a-lift,Lithuanian adventurer set out to run across Australia – but then got a lift,/img/2019/09/23/516594-900325-615x345.jpg
/en/news-in-english/19/2605868/lrt-english-newsletter-dominoes-and-drones,LRT English Newsletter: Dominoes and drones,/img/2025/07/10/2126485-347670-615x345.jpg
/en/news-in-english/19/2604273/swiss-technology-polish-production-new-trains-for-lithuania-on-the-way,"Swiss technology, Polish production: new trains for Lithuania on the way",/img/2025/07/03/2118461-461414-615x345.jpg
/en/news-in-english/19/2601104/hidden-stories-of-lithuania-s-partisan-children-uncovering-the-untold-legacy,Hidden stories of Lithuania’s partisan children: uncovering the untold legacy,/img/2025/06/18/2105698-40145-615x345.jpg
/en/news-in-english/19/2601421/restored-cars-from-siauliai-find-fame-among-hollywood-stars-and-royalty,Restored cars from Šiauliai find fame among Hollywood stars and royalty,/img/2025/06/16/2100143-982776-615x345.jpg
