url,headline,img_path
/en/news-in-english/19/2691691/vilnius-tech-and-taiwanese-scientists-develop-next-generation-communication-chip,VILNIUS TECH and Taiwanese scientists develop next-generation communication chip,/img/2025/09/22/2189111-868424-150x84.jpg
/en/news-in-english/19/2693645/around-20-protest-in-vilnius-calling-for-protection-of-gaza-aid-flotilla,Around 20 protest in Vilnius calling for protection of Gaza aid flotilla,/img/2025/09/26/2195034-864458-150x84.jpg
/en/news-in-english/19/2693480/cultural-revolt-resignations-and-boycott-of-presidential-office-over-culture-minister,Cultural revolt: resignations and boycott of presidential office over culture minister,/img/2025/09/26/2194677-133727-150x84.jpg
/en/news-in-english/19/2693470/vilnius-district-keeps-honorary-title-for-cardinal-sanctioned-over-child-abuse-cover-up,Vilnius District keeps honorary title for cardinal sanctioned over child abuse cover-up,/img/2025/09/04/2172374-552701-150x84.jpg
/en/news-in-english/19/2693396/lithuania-s-panemune-border-crossing-to-close-for-four-hours-on-monday,Lithuania’s Panemunė border crossing to close for four hours on Monday,/img/2024/10/08/1877979-764235-150x84.jpg
/en/news-in-english/19/2691820/once-and-for-all-what-is-the-second-pension-pillar-in-lithuania,Once and for all: what is the second pension pillar in Lithuania?,/img/2025/09/23/2190333-694482-150x84.jpg
/en/news-in-english/19/2693185/poll-lithuanian-party-support-steady-despite-cabinet-fall,Poll: Lithuanian party support steady despite Cabinet fall,/img/2025/09/10/2178225-522107-150x84.jpg
/en/news-in-english/19/2691799/lrt-english-newsletter-here-comes-the-new-government,LRT English Newsletter: Here comes the new government,/img/2025/09/25/2193774-729661-150x84.jpg
/en/news-in-english/19/2691539/international-photography-festival-opens-in-vilnius-take-a-look-at-baltics-and-the-world,International photography festival opens in Vilnius – take a look at Baltics and the world,/img/2025/09/25/2193684-325422-150x84.png
/en/news-in-english/19/2691801/eu-cohesion-funds-could-be-redirected-towards-defence-other-priorities-eu-commissioner,"EU cohesion funds could be redirected towards defence, other priorities – EU commissioner",/img/2024/10/31/1904723-663903-150x84.jpg
/en/news-in-english/19/2691681/vilnius-leads-europe-in-step-challenge-as-cities-clock-over-1-billion-steps,Vilnius leads Europe in step challenge as cities clock over 1 billion steps,/img/2025/09/24/2191232-625439-150x84.jpg
/en/news-in-english/19/2691594/protests-erupt-across-lithuania-over-appointment-of-unqualified-culture-minister-nominee,Protests erupt across Lithuania over appointment of ‘unqualified’ culture minister nominee,/img/2025/09/25/2193466-892367-150x84.jpg
/en/news-in-english/19/2691532/lithuanian-parliament-approves-programme-for-the-new-government,Lithuanian parliament approves programme for the new government,/img/2025/09/25/2193449-223254-150x84.jpg
/en/news-in-english/19/2691414/international-pressure-key-to-change-russia-s-behaviour-lithuanian-president-to-un-chief,International pressure key to change Russia’s behaviour – Lithuanian president to UN chief,/img/2025/09/25/2193363-791270-150x84.jpg
/en/news-in-english/19/2691199/lithuanian-president-urges-cultural-community-to-give-adomavicius-a-chance,Lithuanian president urges cultural community to give Adomavičius a chance,/img/2025/09/23/2190479-850601-150x84.jpg
/en/news-in-english/19/2689714/lithuanian-politicians-clash-over-using-eu-funds-to-buy-brazilian-military-aircraft,Lithuanian politicians clash over using EU funds to buy Brazilian military aircraft,/img/2025/06/18/2106102-450976-150x84.jpg
/en/news-in-english/19/2691799/lrt-english-newsletter-here-comes-the-new-government,LRT English Newsletter: Here comes the new government,
/en/news-in-english/19/2693480/cultural-revolt-resignations-and-boycott-of-presidential-office-over-culture-minister,Cultural revolt: resignations and boycott of presidential office over culture minister,
/en/news-in-english/19/2691691/vilnius-tech-and-taiwanese-scientists-develop-next-generation-communication-chip,VILNIUS TECH and Taiwanese scientists develop next-generation communication chip,/img/2025/09/22/2189111-868424-393x221.jpg
/en/news-in-english/19/2693645/around-20-protest-in-vilnius-calling-for-protection-of-gaza-aid-flotilla,Around 20 protest in Vilnius calling for protection of Gaza aid flotilla,/img/2025/09/26/2195034-864458-393x221.jpg
/en/news-in-english/19/2693470/vilnius-district-keeps-honorary-title-for-cardinal-sanctioned-over-child-abuse-cover-up,Vilnius District keeps honorary title for cardinal sanctioned over child abuse cover-up,/img/2025/09/04/2172374-552701-393x221.jpg
/en/news-in-english/19/2693645/around-20-protest-in-vilnius-calling-for-protection-of-gaza-aid-flotilla,Around 20 protest in Vilnius calling for protection of Gaza aid flotilla,/img/2025/09/26/2195034-864458-615x345.jpg
/en/news-in-english/19/2693396/lithuania-s-panemune-border-crossing-to-close-for-four-hours-on-monday,Lithuania’s Panemunė border crossing to close for four hours on Monday,/img/2024/10/08/1877979-764235-393x221.jpg
/en/news-in-english/19/2693185/poll-lithuanian-party-support-steady-despite-cabinet-fall,Poll: Lithuanian party support steady despite Cabinet fall,/img/2025/09/10/2178225-522107-393x221.jpg
/en/news-in-english/19/2691801/eu-cohesion-funds-could-be-redirected-towards-defence-other-priorities-eu-commissioner,"EU cohesion funds could be redirected towards defence, other priorities – EU commissioner",/img/2024/10/31/1904723-663903-393x221.jpg
/en/news-in-english/19/2691594/protests-erupt-across-lithuania-over-appointment-of-unqualified-culture-minister-nominee,Protests erupt across Lithuania over appointment of ‘unqualified’ culture minister nominee,/img/2025/09/25/2193466-892367-393x221.jpg
/en/news-in-english/19/2689461/sanctions-lifted-prisoners-freed-but-has-anything-changed-in-belarus,"Sanctions lifted, prisoners freed – but has anything changed in Belarus?",/img/2025/07/22/2135703-709578-615x345.jpg
/en/news-in-english/19/2688163/lithuania-protests-to-russia-over-estonian-airspace-violation,Lithuania protests to Russia over Estonian airspace violation,/img/2024/03/17/1728223-734062-615x345.jpg
/en/news-in-english/19/2686317/three-russian-jets-breached-estonian-airspace-for-12-minutes,Three Russian jets breached Estonian airspace for 12 minutes,/img/2025/09/19/2188046-669478-615x345.jpg
/en/news-in-english/19/2681617/david-vs-goliath-moldova-s-fight-for-european-democracy-against-russia-opinion,David vs Goliath: Moldova’s fight for European democracy against Russia – opinion,/img/2025/09/17/2184434-707549-615x345.jpg
/en/news-in-english/19/2691820/once-and-for-all-what-is-the-second-pension-pillar-in-lithuania,Once and for all: what is the second pension pillar in Lithuania?,/img/2025/09/23/2190333-694482-615x345.jpg
/en/news-in-english/19/2689777/real-catastrophe-lithuania-deplores-cuts-to-agriculture-in-eu-s-new-budget,‘Real catastrophe’: Lithuania deplores cuts to agriculture in EU’s new budget,/img/2025/02/12/1989411-771342-615x345.jpg
/en/news-in-english/19/2688507/lithuania-s-yukon-group-completes-liquidation-of-russian-subsidiary,Lithuania’s Yukon Group completes liquidation of Russian subsidiary,/img/2020/09/08/717774-658936-615x345.jpg
/en/news-in-english/19/2683571/lithuania-s-teltonika-opens-four-new-factories-in-eur320m-high-tech-investment,Lithuania’s Teltonika opens four new factories in €320m high-tech investment,/img/2025/09/18/2185237-347857-615x345.jpg
/en/news-in-english/19/2691691/vilnius-tech-and-taiwanese-scientists-develop-next-generation-communication-chip,VILNIUS TECH and Taiwanese scientists develop next-generation communication chip,/img/2025/09/22/2189111-868424-615x345.jpg
/en/news-in-english/19/2693480/cultural-revolt-resignations-and-boycott-of-presidential-office-over-culture-minister,Cultural revolt: resignations and boycott of presidential office over culture minister,/img/2025/09/26/2194677-133727-615x345.jpg
/en/news-in-english/19/2693470/vilnius-district-keeps-honorary-title-for-cardinal-sanctioned-over-child-abuse-cover-up,Vilnius District keeps honorary title for cardinal sanctioned over child abuse cover-up,/img/2025/09/04/2172374-552701-615x345.jpg
/en/news-in-english/19/2691539/international-photography-festival-opens-in-vilnius-take-a-look-at-baltics-and-the-world,International photography festival opens in Vilnius – take a look at Baltics and the world,/img/2025/09/25/2193684-325422-615x345.png
/en/news-in-english/19/2691799/lrt-english-newsletter-here-comes-the-new-government,LRT English Newsletter: Here comes the new government,/img/2025/09/25/2193774-729661-615x345.jpg
/en/news-in-english/19/2688542/baltic-rivalry-lithuania-s-progress-sparks-soul-searching-in-estonia,Baltic rivalry: Lithuania’s progress sparks soul-searching in Estonia,/img/2024/09/06/1852310-873765-615x345.jpg
/en/news-in-english/19/2681358/lithuania-debates-four-day-workweek-as-prime-minister-backs-shorter-schedules,Lithuania debates four-day workweek as prime minister backs shorter schedules,/img/2025/07/22/2135913-400213-615x345.jpg
/en/news-in-english/19/2681197/what-foreigners-really-think-about-lithuania-insights-from-the-butent-festival,What foreigners really think about Lithuania: insights from the Būtent! Festival,/img/2025/09/09/2176735-156332-615x345.jpg
