url,headline,img_path
/en/news-in-english/19/2713733/two-groups-of-irregular-migrants-try-to-enter-lithuania-by-boat,Two groups of irregular migrants try to enter Lithuania by boat,/img/2022/07/26/1310417-240130-150x84.jpg
/en/news-in-english/19/2713728/lithuanian-pm-delighted-with-friendly-relations-with-poland,Lithuanian PM 'delighted' with friendly relations with Poland,/img/2025/10/12/2210551-106579-150x84.jpg
/en/news-in-english/19/2713718/lithuanian-pm-vows-to-pick-a-minister-herself-to-fill-vacant-post,Lithuanian PM vows to pick a minister herself to fill vacant post,/img/2025/10/12/2210370-63431-150x84.jpg
/en/news-in-english/19/2713513/lawyer-seeks-exemption-from-criminal-liability-for-ikea-vilnius-arson-suspect,Lawyer seeks exemption from criminal liability for Ikea Vilnius arson suspect,/img/2025/09/29/2196908-908670-150x84.jpg
/en/news-in-english/19/2713510/lithuania-s-venclova-wins-baltic-assembly-literature-prize,Lithuania’s Venclova wins Baltic Assembly literature prize,/img/2024/10/21/1890191-829991-150x84.jpg
/en/news-in-english/19/2713383/lithuania-s-3rd-honorary-consulate-in-croatia-opens-in-split,Lithuania's 3rd honorary consulate in Croatia opens in Split,/img/2025/10/13/2210768-73607-150x84.jpg
/en/news-in-english/19/2713356/russian-propaganda-exploits-nato-airspace-violations-lithuanian-analysts-say,"Russian propaganda exploits NATO airspace violations, Lithuanian analysts say",/img/2025/10/13/2210917-592619-150x84.jpg
/en/news-in-english/19/2713307/mp-dainius-varnas-quits-nemunas-dawn-amid-anti-semitism-row,MP Dainius Varnas quits Nemunas Dawn amid anti-Semitism row,/img/2025/05/20/2077635-955537-150x84.jpg
/en/news-in-english/19/2713289/military-exercise-storm-strike-begins-in-western-lithuania,Military exercise Storm Strike begins in western Lithuania,/img/2025/10/13/2210702-211734-150x84.jpg
/en/news-in-english/19/2713250/swedbank-and-luminor-to-lend-eur100m-for-construction-of-national-stadium-in-vilnius,Swedbank and Luminor to lend €100m for construction of national stadium in Vilnius,/img/2025/09/03/2171112-222101-150x84.jpg
/en/news-in-english/19/2713191/no-more-silence-hundreds-march-in-vilnius-to-protest-israel-s-actions-in-gaza,No More Silence: Hundreds march in Vilnius to protest Israel’s actions in Gaza,/img/2025/10/11/2210179-397144-150x84.jpg
/en/news-in-english/19/2713149/lithuanian-social-democrats-to-lead-culture-ministry-keep-coalition-with-nemunas-dawn,"Lithuanian Social Democrats to lead Culture Ministry, keep coalition with Nemunas Dawn",/img/2025/10/11/2209991-645836-150x84.jpg
/en/news-in-english/19/2707003/the-narrowing-streets-of-vilnius-are-they-worth-it,The narrowing streets of Vilnius: are they worth it?,/img/2020/07/07/681120-80295-150x84.jpg
/en/news-in-english/19/2699397/ukrainian-photographers-living-in-vilnius-appreciating-natural-photography,Ukrainian photographers living in Vilnius: appreciating natural photography,/img/2025/09/26/2195228-219518-150x84.jpg
/en/news-in-english/19/2707005/lithuanian-family-restaurant-triumphs-in-the-uk-awarded-gold-for-culinary-excellence,Lithuanian family restaurant triumphs in the UK: awarded gold for culinary excellence,/img/2025/10/06/2204562-475141-150x84.jpg
/en/news-in-english/19/2707353/wild-capitalism-icon-vilnius-landmark-office-tower-set-for-demolition-after-two-decades,Wild capitalism icon: Vilnius’ landmark office tower set for demolition after two decades,/img/2024/08/19/1839786-347871-150x84.jpg
/en/news-in-english/19/2707003/the-narrowing-streets-of-vilnius-are-they-worth-it,The narrowing streets of Vilnius: are they worth it?,
/en/news-in-english/19/2713733/two-groups-of-irregular-migrants-try-to-enter-lithuania-by-boat,Two groups of irregular migrants try to enter Lithuania by boat,
/en/news-in-english/19/2713728/lithuanian-pm-delighted-with-friendly-relations-with-poland,Lithuanian PM 'delighted' with friendly relations with Poland,/img/2025/10/12/2210551-106579-393x221.jpg
/en/news-in-english/19/2713718/lithuanian-pm-vows-to-pick-a-minister-herself-to-fill-vacant-post,Lithuanian PM vows to pick a minister herself to fill vacant post,/img/2025/10/12/2210370-63431-393x221.jpg
/en/news-in-english/19/2713513/lawyer-seeks-exemption-from-criminal-liability-for-ikea-vilnius-arson-suspect,Lawyer seeks exemption from criminal liability for Ikea Vilnius arson suspect,/img/2025/09/29/2196908-908670-393x221.jpg
/en/news-in-english/19/2713733/two-groups-of-irregular-migrants-try-to-enter-lithuania-by-boat,Two groups of irregular migrants try to enter Lithuania by boat,/img/2022/07/26/1310417-240130-615x345.jpg
/en/news-in-english/19/2713728/lithuanian-pm-delighted-with-friendly-relations-with-poland,Lithuanian PM 'delighted' with friendly relations with Poland,/img/2025/10/12/2210551-106579-393x221.jpg
/en/news-in-english/19/2713718/lithuanian-pm-vows-to-pick-a-minister-herself-to-fill-vacant-post,Lithuanian PM vows to pick a minister herself to fill vacant post,/img/2025/10/12/2210370-63431-393x221.jpg
/en/news-in-english/19/2713513/lawyer-seeks-exemption-from-criminal-liability-for-ikea-vilnius-arson-suspect,Lawyer seeks exemption from criminal liability for Ikea Vilnius arson suspect,/img/2025/09/29/2196908-908670-393x221.jpg
/en/news-in-english/19/2713510/lithuania-s-venclova-wins-baltic-assembly-literature-prize,Lithuania’s Venclova wins Baltic Assembly literature prize,/img/2024/10/21/1890191-829991-393x221.jpg
/en/news-in-english/19/2713356/russian-propaganda-exploits-nato-airspace-violations-lithuanian-analysts-say,"Russian propaganda exploits NATO airspace violations, Lithuanian analysts say",/img/2025/10/13/2210917-592619-615x345.jpg
/en/news-in-english/19/2709266/minsk-s-vexation-over-russian-stray-drones-shoot-them-down-phone-the-neighbors,"Minsk’s vexation over Russian stray drones: shoot them down, phone the neighbors?",/img/2025/10/10/2209053-879096-615x345.jpg
/en/news-in-english/19/2705749/tsikhanouskaya-s-office-in-vilnius-still-operating-despite-reduced-security,Tsikhanouskaya’s office in Vilnius still operating despite reduced security,/img/2025/01/22/1972087-733472-615x345.jpg
/en/news-in-english/19/2705120/tsikhanouskaya-s-office-in-vilnius-temporarily-halts-work-after-protection-downgrade,Tsikhanouskaya’s office in Vilnius temporarily halts work after protection downgrade,/img/2025/03/09/2013033-268176-615x345.jpg
/en/news-in-english/19/2713250/swedbank-and-luminor-to-lend-eur100m-for-construction-of-national-stadium-in-vilnius,Swedbank and Luminor to lend €100m for construction of national stadium in Vilnius,/img/2025/09/03/2171112-222101-615x345.jpg
/en/news-in-english/19/2709522/lithuania-wins-eu-bid-to-set-up-eur130m-ai-factory,Lithuania wins EU bid to set up €130m AI factory,/img/2020/04/08/633091-847276-615x345.jpg
/en/news-in-english/19/2709162/lithuania-s-exports-fall-1-2-in-january-august-imports-up-4-5,"Lithuania’s exports fall 1.2% in January–August, imports up 4.5%",/img/2023/04/25/1497301-948347-615x345.jpg
/en/news-in-english/19/2707188/google-to-provide-account-verification-services-for-european-clients-from-lithuania,Google to provide account verification services for European clients from Lithuania,/img/2025/09/23/2190319-294144-615x345.jpg
/en/news-in-english/19/2707003/the-narrowing-streets-of-vilnius-are-they-worth-it,The narrowing streets of Vilnius: are they worth it?,/img/2020/07/07/681120-80295-615x345.jpg
/en/news-in-english/19/2707353/wild-capitalism-icon-vilnius-landmark-office-tower-set-for-demolition-after-two-decades,Wild capitalism icon: Vilnius’ landmark office tower set for demolition after two decades,/img/2024/08/19/1839786-347871-615x345.jpg
/en/news-in-english/19/2709212/lithuanian-parliament-backs-bill-to-notify-child-services-of-parental-criminal-convictions,Lithuanian parliament backs bill to notify child services of parental criminal convictions,/img/2025/09/18/2184898-558181-615x345.jpg
/en/news-in-english/19/2707235/almost-half-of-people-in-lithuania-support-protests-against-nemunas-dawn-poll,Almost half of people in Lithuania support protests against Nemunas Dawn – poll,/img/2025/10/05/2203468-252789-615x345.jpg
/en/news-in-english/19/2699397/ukrainian-photographers-living-in-vilnius-appreciating-natural-photography,Ukrainian photographers living in Vilnius: appreciating natural photography,/img/2025/09/26/2195228-219518-615x345.jpg
/en/news-in-english/19/2707005/lithuanian-family-restaurant-triumphs-in-the-uk-awarded-gold-for-culinary-excellence,Lithuanian family restaurant triumphs in the UK: awarded gold for culinary excellence,/img/2025/10/06/2204562-475141-615x345.jpg
/en/news-in-english/19/2700258/inside-lithuania-s-secret-cold-war-missile-base-from-top-secret-silo-to-local-gold-mine,Inside Lithuania’s secret cold war missile base: from top-secret silo to local gold mine,/img/2025/09/19/2187781-561162-615x345.jpg
/en/news-in-english/19/2707978/lrt-english-newsletter-belarus-balloons-and-democrats,"LRT English Newsletter: Belarus, balloons, and democrats",/img/2021/04/02/872550-160245-615x345.jpg
