url,headline,img_path
/en/news-in-english/19/2481630/delfi-lt-owner-ordered-to-divest-lrytas-lt-over-competition-concerns,Delfi.lt owner ordered to divest Lrytas.lt over competition concerns,/img/2025/02/07/1984305-248459-150x84.jpg
/en/news-in-english/19/2481463/head-of-lithuania-s-road-authority-sacked,Head of Lithuania’s road authority sacked,/img/2024/11/15/1919462-704572-150x84.jpg
/en/news-in-english/19/2481297/baltic-grid-synchronisation-is-more-geopolitical-than-technical-switch-litgrid-head,Baltic grid synchronisation is more geopolitical than technical switch – Litgrid head,/img/2023/11/15/1625617-330821-150x84.jpg
/en/news-in-english/19/2481052/palanga-hosts-traditional-smelt-festival,Palanga hosts traditional Smelt Festival,/img/2022/02/12/1193257-694006-150x84.jpg
/en/news-in-english/19/2480415/lrt-english-newsletter-the-last-decouple,LRT English Newsletter: The last decouple,/img/2023/11/13/1624250-679053-150x84.jpg
/en/news-in-english/19/2480752/no-need-to-comment-on-everything-donald-trump-says-lithuanian-pm,No need to comment on everything Donald Trump says – Lithuanian PM,/img/2025/02/04/1981457-465726-150x84.jpg
/en/news-in-english/19/2480743/italy-to-deploy-air-defence-systems-for-nato-s-exercise-in-lithuania,Italy to deploy air defence systems for NATO’s exercise in Lithuania,/img/2025/01/27/1975262-329431-150x84.jpg
/en/news-in-english/19/2480603/lithuanian-president-confident-baltic-power-grid-switch-will-go-smoothly,Lithuanian president confident Baltic power grid switch will go smoothly,/img/2025/02/06/1983308-268330-150x84.jpg
/en/news-in-english/19/2480452/minority-shareholder-confirms-bid-to-buy-lithuania-s-achema-group,Minority shareholder confirms bid to buy Lithuania’s Achema Group,/img/2022/09/08/1338093-433000-150x84.jpg
/en/news-in-english/19/2480306/volunteers-train-to-protect-lithuania-s-electric-link-with-poland,Volunteers train to protect Lithuania’s electric link with Poland,/img/2025/01/17/1969140-112406-150x84.jpg
/en/news-in-english/19/2479966/lithuania-s-economy-expected-to-grow-this-year-inflation-will-rise-imf,"Lithuania’s economy expected to grow this year, inflation will rise – IMF",/img/2024/12/12/1942564-826572-150x84.jpg
/en/news-in-english/19/2479505/another-independence-day-baltics-count-days-to-syncing-with-european-electric-grid,Another independence day: Baltics count days to syncing with European electric grid,/img/2024/10/31/1904848-177846-150x84.jpg
/en/news-in-english/19/2479652/lithuania-should-fund-the-military-through-higher-gdp-growth-president-s-adviser,Lithuania should fund the military through higher GDP growth – president’s adviser,/img/2023/09/18/1590665-623778-150x84.jpg
/en/news-in-english/19/2479602/additional-eur20m-needed-for-ukrainian-refugees-in-lithuania-unhcr,Additional €20m needed for Ukrainian refugees in Lithuania – UNHCR,/img/2022/03/29/1227755-719079-150x84.jpg
/en/news-in-english/19/2479522/lithuanian-minister-suggests-accepting-some-migrants-paying-eu-levy-for-rest,"Lithuanian minister suggests accepting some migrants, paying EU levy for rest",/img/2024/12/29/1952899-592947-150x84.jpg
/en/news-in-english/19/2479361/estonian-missile-maker-to-open-office-in-lithuania-hires-former-vice-minister,"Estonian missile maker to open office in Lithuania, hires former vice-minister",/img/2023/11/09/1622468-852263-150x84.jpg
/en/news-in-english/19/2480415/lrt-english-newsletter-the-last-decouple,LRT English Newsletter: The last decouple,
/en/news-in-english/19/2481463/head-of-lithuania-s-road-authority-sacked,Head of Lithuania’s road authority sacked,
/en/news-in-english/19/2481630/delfi-lt-owner-ordered-to-divest-lrytas-lt-over-competition-concerns,Delfi.lt owner ordered to divest Lrytas.lt over competition concerns,/img/2025/02/07/1984305-248459-393x221.jpg
/en/news-in-english/19/2481297/baltic-grid-synchronisation-is-more-geopolitical-than-technical-switch-litgrid-head,Baltic grid synchronisation is more geopolitical than technical switch – Litgrid head,/img/2023/11/15/1625617-330821-393x221.jpg
/en/news-in-english/19/2481052/palanga-hosts-traditional-smelt-festival,Palanga hosts traditional Smelt Festival,/img/2022/02/12/1193257-694006-393x221.jpg
/en/news-in-english/19/2480752/no-need-to-comment-on-everything-donald-trump-says-lithuanian-pm,No need to comment on everything Donald Trump says – Lithuanian PM,/img/2025/02/04/1981457-465726-615x345.jpg
/en/news-in-english/19/2480743/italy-to-deploy-air-defence-systems-for-nato-s-exercise-in-lithuania,Italy to deploy air defence systems for NATO’s exercise in Lithuania,/img/2025/01/27/1975262-329431-393x221.jpg
/en/news-in-english/19/2479522/lithuanian-minister-suggests-accepting-some-migrants-paying-eu-levy-for-rest,"Lithuanian minister suggests accepting some migrants, paying EU levy for rest",/img/2024/12/29/1952899-592947-393x221.jpg
/en/news-in-english/19/2479091/lithuania-detains-belarusians-seizes-17-trucks-for-sanction-violations,"Lithuania detains Belarusians, seizes 17 trucks for sanction violations",/img/2025/02/05/1981927-946521-393x221.jpg
/en/news-in-english/19/2478662/lithuanian-pm-backs-proposal-to-disclose-officials-with-kgb-past,Lithuanian PM backs proposal to disclose officials with KGB past,/img/2019/10/03/523838-547472-393x221.jpg
/en/news-in-english/19/2474408/lithuanian-president-sceptical-about-ceasefire-in-ukraine-war,Lithuanian president ‘sceptical’ about ceasefire in Ukraine war,/img/2024/04/11/1747942-523875-615x345.jpg
/en/news-in-english/19/2473473/lithuania-s-mfa-says-it-couldn-t-assist-citizens-in-trouble-in-belarus,Lithuania’s MFA says it couldn’t assist citizens in trouble in Belarus,/img/2025/01/30/1977875-140988-615x345.jpg
/en/news-in-english/19/2470384/lukashenko-will-never-be-belarus-legitimate-leader-lithuanian-president,Lukashenko will never be Belarus’ legitimate leader – Lithuanian president,/img/2025/01/26/1974916-513983-615x345.jpg
/en/news-in-english/19/2468254/lithuania-calls-to-address-safety-issues-at-belarus-nuclear-plant,Lithuania calls to address safety issues at Belarus nuclear plant,/img/2020/11/09/769589-568687-615x345.jpg
/en/news-in-english/19/2481630/delfi-lt-owner-ordered-to-divest-lrytas-lt-over-competition-concerns,Delfi.lt owner ordered to divest Lrytas.lt over competition concerns,/img/2025/02/07/1984305-248459-615x345.jpg
/en/news-in-english/19/2481463/head-of-lithuania-s-road-authority-sacked,Head of Lithuania’s road authority sacked,/img/2024/11/15/1919462-704572-615x345.jpg
/en/news-in-english/19/2481297/baltic-grid-synchronisation-is-more-geopolitical-than-technical-switch-litgrid-head,Baltic grid synchronisation is more geopolitical than technical switch – Litgrid head,/img/2023/11/15/1625617-330821-615x345.jpg
/en/news-in-english/19/2480603/lithuanian-president-confident-baltic-power-grid-switch-will-go-smoothly,Lithuanian president confident Baltic power grid switch will go smoothly,/img/2025/02/06/1983308-268330-615x345.jpg
/en/news-in-english/19/2481052/palanga-hosts-traditional-smelt-festival,Palanga hosts traditional Smelt Festival,/img/2022/02/12/1193257-694006-615x345.jpg
/en/news-in-english/19/2479602/additional-eur20m-needed-for-ukrainian-refugees-in-lithuania-unhcr,Additional €20m needed for Ukrainian refugees in Lithuania – UNHCR,/img/2022/03/29/1227755-719079-615x345.jpg
/en/news-in-english/19/2478600/lithuanian-president-s-up-close-biography-to-be-published-this-month,Lithuanian president’s ‘up close’ biography to be published this month,/img/2020/02/22/607665-217839-615x345.jpg
/en/news-in-english/19/2478497/end-of-january-in-lithuania-was-warmest-since-1961,End of January in Lithuania was warmest since 1961,/img/2024/05/09/1768611-556586-615x345.jpg
/en/news-in-english/19/2480415/lrt-english-newsletter-the-last-decouple,LRT English Newsletter: The last decouple,/img/2023/11/13/1624250-679053-615x345.jpg
/en/news-in-english/19/2479505/another-independence-day-baltics-count-days-to-syncing-with-european-electric-grid,Another independence day: Baltics count days to syncing with European electric grid,/img/2024/10/31/1904848-177846-615x345.jpg
/en/news-in-english/19/2478518/lithuania-china-relations-a-half-hearted-attempt-at-a-thaw,Lithuania-China relations: a half-hearted attempt at a thaw?,/img/2022/01/20/1178706-524997-615x345.jpg
/en/news-in-english/19/2475001/pleasing-the-hegemon-will-lithuania-s-not-taking-sides-on-greenland-backfire,Pleasing the hegemon: will Lithuania’s ‘not taking sides’ on Greenland backfire?,/img/2025/01/31/1979317-538094-615x345.jpg
