url,headline,img_path
/en/news-in-english/19/2948379/lithuania-rejects-moscow-claims-of-soviet-grave-desecration,Lithuania rejects Moscow claims of Soviet grave desecration,/img/2022/05/03/1251749-590400-150x84.jpg
/en/news-in-english/19/2948336/lithuania-involved-in-discussions-on-possible-us-nuclear-deployment-in-europe,Lithuania involved in discussions on possible US nuclear deployment in Europe,/img/2020/10/22/746832-357758-150x84.jpg
/en/news-in-english/19/2948278/lithuanian-parliament-adopts-softened-lrt-changes-following-protests-explainer,Lithuanian parliament adopts softened LRT changes following protests – explainer,/img/2025/11/27/2250539-745973-150x84.jpg
/en/news-in-english/19/2948222/more-than-1-000-us-troops-leave-lithuania-after-rotation-ends,"More than 1,000 US troops leave Lithuania after rotation ends",/img/2026/05/21/2395484-394102-150x84.jpg
/en/news-in-english/19/2948163/lithuanian-municipality-rejects-russian-claims-over-relocation-of-wwii-soldiers-remains,Lithuanian municipality rejects Russian claims over relocation of WWII soldiers' remains,/img/2021/08/26/1039302-384646-150x84.jpg
/en/news-in-english/19/2948145/lithuania-s-deputy-defence-minister-tomas-godliauskas-to-step-down-by-mutual-agreement,Lithuania's deputy defence minister Tomas Godliauskas to step down by mutual agreement,/img/2026/03/31/2357785-536599-150x84.jpg
/en/news-in-english/19/2948120/lithuania-to-provide-eur4m-for-solar-power-projects-in-ukrainian-schools-and-hospitals,Lithuania to provide €4m for solar power projects in Ukrainian schools and Hospitals,/img/2026/03/19/2348161-242351-150x84.jpg
/en/news-in-english/19/2948100/trump-nominates-lawyer-keith-noreika-as-us-ambassador-to-lithuania,Trump nominates lawyer Keith Noreika as US ambassador to Lithuania,/img/2025/09/30/2198056-984244-150x84.jpg
/en/news-in-english/19/2948080/lithuania-and-ukraine-join-forces-on-defence-innovation,Lithuania and Ukraine join forces on defence innovation,/img/2026/05/27/2399988-210404-150x84.jpg
/en/news-in-english/19/2947363/lithuanians-in-northern-cyprus-investment-or-moral-bankruptcy-opinion,Lithuanians in Northern Cyprus: investment or moral bankruptcy? – opinion,/img/2026/05/27/2399864-527053-150x84.jpg
/en/news-in-english/19/2947261/everything-is-pink-vilnius-celebrates-cold-beetroot-soup,'Everything is pink' Vilnius celebrates cold beetroot soup,/img/2026/05/30/2402489-138398-150x84.jpg
/en/news-in-english/19/2947330/russia-bolstering-baltic-sea-presence-to-protect-shadow-fleet-lithuania-says,"Russia bolstering Baltic Sea presence to protect shadow fleet, Lithuania says",/img/2025/10/16/2214127-691596-150x84.jpg
/en/news-in-english/19/2947252/ukrainian-specialists-to-assess-lithuania-s-air-defence-strategy,Ukrainian specialists to assess Lithuania’s air defence strategy,/img/2024/09/02/1848595-195899-150x84.jpg
/en/news-in-english/19/2947226/petition-for-mandatory-lithuanian-language-skills-for-foreigners-tops-22-500-signatures,"Petition for mandatory Lithuanian language skills for foreigners tops 22,500 signatures",/img/2025/07/09/2125639-284497-150x84.jpg
/en/news-in-english/19/2947218/nato-parliamentary-chief-blames-russia-for-drone-incursions-into-allied-territory,NATO parliamentary chief blames Russia for drone incursions into allied territory,/img/2022/05/11/1259100-628630-150x84.jpg
/en/news-in-english/19/2947214/kubilius-says-lithuania-lacks-clear-strategy-for-strengthening-air-defence,Kubilius says Lithuania lacks clear strategy for strengthening air defence,/img/2026/05/26/2398944-437761-150x84.jpg
/en/news-in-english/19/2948278/lithuanian-parliament-adopts-softened-lrt-changes-following-protests-explainer,Lithuanian parliament adopts softened LRT changes following protests – explainer,
/en/news-in-english/19/2948336/lithuania-involved-in-discussions-on-possible-us-nuclear-deployment-in-europe,Lithuania involved in discussions on possible US nuclear deployment in Europe,
/en/news-in-english/19/2948222/more-than-1-000-us-troops-leave-lithuania-after-rotation-ends,"More than 1,000 US troops leave Lithuania after rotation ends",/img/2026/05/21/2395484-394102-393x221.jpg
/en/news-in-english/19/2948379/lithuania-rejects-moscow-claims-of-soviet-grave-desecration,Lithuania rejects Moscow claims of Soviet grave desecration,/img/2022/05/03/1251749-590400-393x221.jpg
/en/news-in-english/19/2948163/lithuanian-municipality-rejects-russian-claims-over-relocation-of-wwii-soldiers-remains,Lithuanian municipality rejects Russian claims over relocation of WWII soldiers' remains,/img/2021/08/26/1039302-384646-393x221.jpg
/en/news-in-english/19/2948379/lithuania-rejects-moscow-claims-of-soviet-grave-desecration,Lithuania rejects Moscow claims of Soviet grave desecration,/img/2022/05/03/1251749-590400-615x345.jpg
/en/news-in-english/19/2948336/lithuania-involved-in-discussions-on-possible-us-nuclear-deployment-in-europe,Lithuania involved in discussions on possible US nuclear deployment in Europe,/img/2020/10/22/746832-357758-393x221.jpg
/en/news-in-english/19/2948278/lithuanian-parliament-adopts-softened-lrt-changes-following-protests-explainer,Lithuanian parliament adopts softened LRT changes following protests – explainer,/img/2025/11/27/2250539-745973-393x221.jpg
/en/news-in-english/19/2948222/more-than-1-000-us-troops-leave-lithuania-after-rotation-ends,"More than 1,000 US troops leave Lithuania after rotation ends",/img/2026/05/21/2395484-394102-393x221.jpg
/en/news-in-english/19/2948163/lithuanian-municipality-rejects-russian-claims-over-relocation-of-wwii-soldiers-remains,Lithuanian municipality rejects Russian claims over relocation of WWII soldiers' remains,/img/2021/08/26/1039302-384646-393x221.jpg
/en/news-in-english/19/2947218/nato-parliamentary-chief-blames-russia-for-drone-incursions-into-allied-territory,NATO parliamentary chief blames Russia for drone incursions into allied territory,/img/2022/05/11/1259100-628630-615x345.jpg
/en/news-in-english/19/2944215/how-the-russian-orthodox-church-targets-anti-war-priests,How the Russian Orthodox Church targets anti-war priests,/img/2022/11/24/1391273-757870-615x345.jpg
/en/news-in-english/19/2944251/in-latvia-s-pine-forests-nato-s-drone-future-takes-shape,"In Latvia’s pine forests, NATO’s drone future takes shape",/img/2023/10/01/1599056-475837-615x345.jpg
/en/news-in-english/19/2943275/german-dutch-corps-to-lead-nato-forces-in-estonia-and-latvia-reuters,German-Dutch corps to lead NATO forces in Estonia and Latvia – Reuters,/img/2025/10/13/2210714-814283-615x345.jpg
/en/news-in-english/19/2948120/lithuania-to-provide-eur4m-for-solar-power-projects-in-ukrainian-schools-and-hospitals,Lithuania to provide €4m for solar power projects in Ukrainian schools and Hospitals,/img/2026/03/19/2348161-242351-615x345.jpg
/en/news-in-english/19/2939259/people-in-lithuania-work-the-least-weekends-in-eu,People in Lithuania work the least weekends in EU,/img/2021/04/22/952787-936420-615x345.jpg
/en/news-in-english/19/2932283/brussels-approves-eur153m-in-additional-funding-for-lithuania,Brussels approves €153m in additional funding for Lithuania,/img/2026/03/28/2355899-379958-615x345.jpg
/en/news-in-english/19/2932132/lithuania-risks-breaching-eu-fiscal-rules-as-defence-spending-mounts,Lithuania risks breaching EU fiscal rules as defence spending mounts,/img/2022/09/22/1348436-818889-615x345.jpg
/en/news-in-english/19/2947261/everything-is-pink-vilnius-celebrates-cold-beetroot-soup,'Everything is pink' Vilnius celebrates cold beetroot soup,/img/2026/05/30/2402489-138398-615x345.jpg
/en/news-in-english/19/2944072/lithuanian-mp-and-former-olympian-jevgenijus-suklinas-dies-aged-40,Lithuanian MP and former Olympian Jevgenijus Šuklinas dies aged 40,/img/2026/05/28/2401185-284266-615x345.jpg
/en/news-in-english/19/2936076/men-dominate-lithuanian-textbooks-while-women-are-cast-as-teachers-milkmaids-and-nuns,"Men dominate Lithuanian textbooks while women are cast as teachers, milkmaids and nuns",/img/2025/03/15/2017838-897053-615x345.jpg
/en/news-in-english/19/2941229/lithuania-to-host-2028-world-junior-figure-skating-championships,Lithuania to host 2028 World Junior Figure Skating Championships,/img/2026/05/26/2398653-692919-615x345.jpg
/en/news-in-english/19/2947363/lithuanians-in-northern-cyprus-investment-or-moral-bankruptcy-opinion,Lithuanians in Northern Cyprus: investment or moral bankruptcy? – opinion,/img/2026/05/27/2399864-527053-615x345.jpg
/en/news-in-english/19/2943284/former-obama-adviser-he-was-prepared-to-go-to-war-for-the-baltic-states,Former Obama adviser: He was prepared to go to war for the Baltic states,/img/2026/05/28/2400580-437426-615x345.jpg
/en/news-in-english/19/2941108/invisible-and-uncounted-being-deafblind-in-lithuania,Invisible and uncounted: being deafblind in Lithuania,/img/2025/09/27/2195561-654523-615x345.jpg
/en/news-in-english/19/2944216/trafficked-from-philippines-to-lithuania-humiliated-trapped-and-left-without-papers,"Trafficked from Philippines to Lithuania: humiliated, trapped, and left without papers",/img/2026/05/27/2400242-393091-615x345.jpg
