url,headline,img_path
/en/news-in-english/19/2958195/radio-history-from-1920s-pop-music-to-countering-fascism-in-lithuania,Radio history – from 1920s pop music to countering fascism in Lithuania,/img/2026/06/10/2413176-197797-150x84.jpg
/en/news-in-english/19/2959035/vilnius-yellow-air-alert-lifted-after-radar-contact-identified-as-weather-balloon,Vilnius yellow air alert lifted after radar contact identified as weather balloon,/img/2026/06/13/2416296-305358-150x84.jpg
/en/news-in-english/19/2958169/lrt-radio-turns-100-milestones-from-a-century-of-lithuanian-broadcasting,LRT RADIO turns 100: milestones from a century of Lithuanian broadcasting,/img/2026/06/11/2414154-951722-150x84.jpg
/en/news-in-english/19/2958372/lithuania-and-cyprus-sign-migrant-relocation-deal-under-eu-solidarity-scheme,Lithuania and Cyprus sign migrant relocation deal under EU solidarity scheme,/img/2026/04/05/2361682-485340-150x84.jpg
/en/news-in-english/19/2958365/lithuanian-president-signs-overhaul-of-lrt-governance,Lithuanian president signs overhaul of LRT governance,/img/2025/11/27/2250538-681774-150x84.jpg
/en/news-in-english/19/2958300/lithuanian-foreign-minister-meets-belarusian-opposition-reaffirms-support,"Lithuanian foreign minister meets Belarusian opposition, reaffirms support",/img/2024/08/12/1836806-413780-150x84.jpg
/en/news-in-english/19/2958257/russia-is-building-military-infrastructure-along-its-borders-with-northern-europe-baltics,"Russia is building military infrastructure along its borders with Northern Europe, Baltics",/img/2026/06/12/2415211-13507-150x84.jpg
/en/news-in-english/19/2958244/coalition-deal-nears-completion-in-lithuania-but-prime-minister-s-future-remains-unclear,"Coalition deal nears completion in Lithuania, but Prime Minister’s future remains unclear",/img/2026/06/11/2414257-276252-150x84.jpg
/en/news-in-english/19/2958160/lithuanian-appeal-court-to-rule-in-september-on-partisan-monument-vandalism-case,Lithuanian appeal court to rule in September on partisan monument vandalism case,/img/2020/10/26/749637-585187-150x84.jpg
/en/news-in-english/19/2958091/baltic-polish-ngos-call-for-review-of-migrant-pushbacks-at-belarus-border,"Baltic, Polish NGOs call for review of migrant pushbacks at Belarus border",/img/2025/08/26/2163677-895989-150x84.jpg
/en/news-in-english/19/2958061/lithuania-ratifies-asean-treaty-of-amity-and-cooperation,Lithuania ratifies ASEAN Treaty of Amity and Cooperation,/img/2025/12/27/2275454-835138-150x84.jpg
/en/news-in-english/19/2957409/lrt-english-newsletter-end-of-far-right-populists-in-government,LRT English Newsletter: End of ‘far-right populists’ in government,/img/2025/08/25/2162989-129378-150x84.jpg
/en/news-in-english/19/2957389/lithuanian-drone-unit-aimed-at-offence-not-defence-military-chief,"Lithuanian drone unit aimed at offence, not defence – military chief",/img/2026/05/27/2400402-711739-150x84.png
/en/news-in-english/19/2957385/lithuania-debates-compensating-for-damage-caused-by-nato-and-armed-forces,Lithuania debates compensating for damage caused by NATO and armed forces,/img/2026/05/18/2392737-277319-150x84.jpg
/en/news-in-english/19/2957350/canadian-backed-firm-canbalt-plans-500m-euro-defence-park-in-central-lithuania,Canadian-backed firm CanBalt plans 500m euro defence park in central Lithuania,/img/2025/07/29/2141330-644630-150x84.jpg
/en/news-in-english/19/2957234/drone-era-reshaping-warfare-says-us-defense-manufacturing-executive,"Drone era reshaping warfare, says US defense manufacturing executive",/img/2026/05/25/2398157-937080-150x84.jpg
/en/news-in-english/19/2959035/vilnius-yellow-air-alert-lifted-after-radar-contact-identified-as-weather-balloon,Vilnius yellow air alert lifted after radar contact identified as weather balloon,
/en/news-in-english/19/2958169/lrt-radio-turns-100-milestones-from-a-century-of-lithuanian-broadcasting,LRT RADIO turns 100: milestones from a century of Lithuanian broadcasting,
/en/news-in-english/19/2958195/radio-history-from-1920s-pop-music-to-countering-fascism-in-lithuania,Radio history – from 1920s pop music to countering fascism in Lithuania,/img/2026/06/10/2413176-197797-393x221.jpg
/en/news-in-english/19/2958372/lithuania-and-cyprus-sign-migrant-relocation-deal-under-eu-solidarity-scheme,Lithuania and Cyprus sign migrant relocation deal under EU solidarity scheme,/img/2026/04/05/2361682-485340-393x221.jpg
/en/news-in-english/19/2958365/lithuanian-president-signs-overhaul-of-lrt-governance,Lithuanian president signs overhaul of LRT governance,/img/2025/11/27/2250538-681774-393x221.jpg
/en/news-in-english/19/2959035/vilnius-yellow-air-alert-lifted-after-radar-contact-identified-as-weather-balloon,Vilnius yellow air alert lifted after radar contact identified as weather balloon,/img/2026/06/13/2416296-305358-615x345.jpg
/en/news-in-english/19/2958372/lithuania-and-cyprus-sign-migrant-relocation-deal-under-eu-solidarity-scheme,Lithuania and Cyprus sign migrant relocation deal under EU solidarity scheme,/img/2026/04/05/2361682-485340-393x221.jpg
/en/news-in-english/19/2958365/lithuanian-president-signs-overhaul-of-lrt-governance,Lithuanian president signs overhaul of LRT governance,/img/2025/11/27/2250538-681774-393x221.jpg
/en/news-in-english/19/2958300/lithuanian-foreign-minister-meets-belarusian-opposition-reaffirms-support,"Lithuanian foreign minister meets Belarusian opposition, reaffirms support",/img/2024/08/12/1836806-413780-393x221.jpg
/en/news-in-english/19/2958244/coalition-deal-nears-completion-in-lithuania-but-prime-minister-s-future-remains-unclear,"Coalition deal nears completion in Lithuania, but Prime Minister’s future remains unclear",/img/2026/06/11/2414257-276252-393x221.jpg
/en/news-in-english/19/2958257/russia-is-building-military-infrastructure-along-its-borders-with-northern-europe-baltics,"Russia is building military infrastructure along its borders with Northern Europe, Baltics",/img/2026/06/12/2415211-13507-615x345.jpg
/en/news-in-english/19/2956351/latvian-pm-ukrainian-drone-experts-arriving-in-latvia-next-week,Latvian PM: Ukrainian drone experts arriving in Latvia next week,/img/2026/06/10/2413105-64328-615x345.jpg
/en/news-in-english/19/2947218/nato-parliamentary-chief-blames-russia-for-drone-incursions-into-allied-territory,NATO parliamentary chief blames Russia for drone incursions into allied territory,/img/2022/05/11/1259100-628630-615x345.jpg
/en/news-in-english/19/2944215/how-the-russian-orthodox-church-targets-anti-war-priests,How the Russian Orthodox Church targets anti-war priests,/img/2022/11/24/1391273-757870-615x345.jpg
/en/news-in-english/19/2957111/binance-withdraws-from-lithuania,Binance withdraws from Lithuania,/img/2026/06/11/2413519-211406-615x345.jpg
/en/news-in-english/19/2954339/eu-approves-eur884-million-plan-for-lithuania-to-cut-energy-costs-expand-public-transport,"EU approves €884 million plan for Lithuania to cut energy costs, expand public transport",/img/2026/01/11/2285574-428955-615x345.jpg
/en/news-in-english/19/2950305/should-algorithms-dictate-the-price-for-gig-workers-lithuanian-government-is-divided,Should algorithms dictate the price for gig workers? Lithuanian government is divided,/img/2025/12/14/2265614-231049-615x345.jpg
/en/news-in-english/19/2951219/train-fares-up-after-lithuania-s-50-discount-ends,Train fares up after Lithuania's 50% discount ends,/img/2025/12/14/2265518-778856-615x345.jpg
/en/news-in-english/19/2957081/lithuanian-government-backs-changes-to-adopt-eu-migration-and-asylum-pact,Lithuanian government backs changes to adopt EU migration and asylum pact,/img/2021/11/18/1121039-974458-615x345.jpg
/en/news-in-english/19/2956193/lithuania-mulls-new-levy-on-employers-to-fund-migrant-worker-protection,Lithuania mulls new levy on employers to fund migrant worker protection,/img/2024/03/25/1734952-709255-615x345.jpg
/en/news-in-english/19/2956336/more-than-30-human-rights-groups-urge-coalition-not-to-reappoint-justice-minister,More than 30 human rights groups urge coalition not to reappoint justice minister,/img/2025/10/27/2223603-354072-615x345.jpg
/en/news-in-english/19/2956127/he-was-our-father-lithuanian-basketball-legend-garastas-dies-aged-94,‘He was our father’: Lithuanian basketball legend Garastas dies aged 94,/img/2026/06/10/2412438-831593-615x345.jpg
/en/news-in-english/19/2958195/radio-history-from-1920s-pop-music-to-countering-fascism-in-lithuania,Radio history – from 1920s pop music to countering fascism in Lithuania,/img/2026/06/10/2413176-197797-615x345.jpg
/en/news-in-english/19/2958169/lrt-radio-turns-100-milestones-from-a-century-of-lithuanian-broadcasting,LRT RADIO turns 100: milestones from a century of Lithuanian broadcasting,/img/2026/06/11/2414154-951722-615x345.jpg
/en/news-in-english/19/2957409/lrt-english-newsletter-end-of-far-right-populists-in-government,LRT English Newsletter: End of ‘far-right populists’ in government,/img/2025/08/25/2162989-129378-615x345.jpg
/en/news-in-english/19/2957234/drone-era-reshaping-warfare-says-us-defense-manufacturing-executive,"Drone era reshaping warfare, says US defense manufacturing executive",/img/2026/05/25/2398157-937080-615x345.jpg
