url,headline,img_path
/en/news-in-english/19/2933328/lithuania-backs-armenia-s-eu-bid-foreign-minister-says-in-yerevan,"Lithuania backs Armenia’s EU bid, foreign minister says in Yerevan",/img/2020/02/13/601783-737720-150x84.jpg
/en/news-in-english/19/2933248/nato-fighter-jet-stationed-in-lithuania-shoots-down-drone-in-estonia,NATO fighter jet stationed in Lithuania shoots down drone in Estonia,/img/2025/10/20/2217131-970838-150x84.jpg
/en/news-in-english/19/2933201/lithuanian-officials-back-talks-on-allowing-nuclear-weapons-on-country-s-territory,Lithuanian officials back talks on allowing nuclear weapons on country’s territory,/img/2023/03/06/1463033-523584-150x84.jpg
/en/news-in-english/19/2933148/lithuania-ranks-among-worst-in-europe-on-transgender-rights-index-shows,"Lithuania ranks among worst in Europe on transgender rights, index shows",/img/2025/04/10/2041668-433742-150x84.jpg
/en/news-in-english/19/2933058/lithuania-warns-of-possible-provocations-after-russian-drone-allegations,Lithuania warns of possible provocations after Russian drone allegations,/img/2024/04/04/1743672-438055-150x84.jpg
/en/news-in-english/19/2925306/despite-favourable-court-rulings-same-sex-couples-face-new-roadblocks-in-lithuania,"Despite favourable court rulings, same-sex couples face new roadblocks in Lithuania",/img/2025/09/11/2179001-231934-150x84.jpg
/en/news-in-english/19/2932362/lithuania-decides-against-withdrawing-from-venice-biennale-despite-russia-controversy,Lithuania decides against withdrawing from Venice Biennale despite Russia controversy,/img/2026/05/18/2392560-192452-150x84.jpg
/en/news-in-english/19/2932051/drone-that-crashed-in-lithuania-neutralised-in-a-controlled-explosion,Drone that crashed in Lithuania neutralised in a controlled explosion,/img/2026/05/18/2392737-277319-150x84.jpg
/en/news-in-english/19/2932283/brussels-approves-eur153m-in-additional-funding-for-lithuania,Brussels approves €153m in additional funding for Lithuania,/img/2026/03/28/2355899-379958-150x84.jpg
/en/news-in-english/19/2932265/sweden-s-king-and-queen-visit-lithuania,Sweden’s king and queen visit Lithuania,/img/2019/07/30/482359-985773-150x84.jpg
/en/news-in-english/19/2932257/putin-s-rule-is-nearing-its-end-kara-murza-says-in-vilnius,"Putin’s rule is nearing its end, Kara-Murza says in Vilnius",/img/2019/05/31/439846-597949-150x84.jpg
/en/news-in-english/19/2932247/lithuania-s-drone-early-warning-system-not-functioning-properly-official,Lithuania’s drone early warning system not functioning properly – official,/img/2025/12/30/2277645-467723-150x84.jpg
/en/news-in-english/19/2932132/lithuania-risks-breaching-eu-fiscal-rules-as-defence-spending-mounts,Lithuania risks breaching EU fiscal rules as defence spending mounts,/img/2022/09/22/1348436-818889-150x84.jpg
/en/news-in-english/19/2932112/lithuanian-president-too-early-to-draw-conclusions-on-us-troop-movements,Lithuanian president: too early to draw conclusions on US troop movements,/img/2026/05/07/2384075-17559-150x84.jpg
/en/news-in-english/19/2932087/lithuania-would-only-send-troops-to-strait-of-hormuz-after-us-iran-peace-deal-president,Lithuania would only send troops to Strait of Hormuz after US-Iran peace deal – president,/img/2026/05/12/2387847-343558-150x84.jpg
/en/news-in-english/19/2932077/defence-minister-presses-air-force-on-radar-gaps-after-drone-crash-goes-undetected,Defence minister presses Air Force on radar gaps after drone crash goes undetected,/img/2026/05/07/2383641-490871-150x84.jpg
/en/news-in-english/19/2933248/nato-fighter-jet-stationed-in-lithuania-shoots-down-drone-in-estonia,NATO fighter jet stationed in Lithuania shoots down drone in Estonia,
/en/news-in-english/19/2933058/lithuania-warns-of-possible-provocations-after-russian-drone-allegations,Lithuania warns of possible provocations after Russian drone allegations,
/en/news-in-english/19/2925306/despite-favourable-court-rulings-same-sex-couples-face-new-roadblocks-in-lithuania,"Despite favourable court rulings, same-sex couples face new roadblocks in Lithuania",/img/2025/09/11/2179001-231934-393x221.jpg
/en/news-in-english/19/2933328/lithuania-backs-armenia-s-eu-bid-foreign-minister-says-in-yerevan,"Lithuania backs Armenia’s EU bid, foreign minister says in Yerevan",/img/2020/02/13/601783-737720-393x221.jpg
/en/news-in-english/19/2933201/lithuanian-officials-back-talks-on-allowing-nuclear-weapons-on-country-s-territory,Lithuanian officials back talks on allowing nuclear weapons on country’s territory,/img/2023/03/06/1463033-523584-393x221.jpg
/en/news-in-english/19/2933248/nato-fighter-jet-stationed-in-lithuania-shoots-down-drone-in-estonia,NATO fighter jet stationed in Lithuania shoots down drone in Estonia,/img/2025/10/20/2217131-970838-615x345.jpg
/en/news-in-english/19/2933201/lithuanian-officials-back-talks-on-allowing-nuclear-weapons-on-country-s-territory,Lithuanian officials back talks on allowing nuclear weapons on country’s territory,/img/2023/03/06/1463033-523584-393x221.jpg
/en/news-in-english/19/2933058/lithuania-warns-of-possible-provocations-after-russian-drone-allegations,Lithuania warns of possible provocations after Russian drone allegations,/img/2024/04/04/1743672-438055-393x221.jpg
/en/news-in-english/19/2932362/lithuania-decides-against-withdrawing-from-venice-biennale-despite-russia-controversy,Lithuania decides against withdrawing from Venice Biennale despite Russia controversy,/img/2026/05/18/2392560-192452-393x221.jpg
/en/news-in-english/19/2932051/drone-that-crashed-in-lithuania-neutralised-in-a-controlled-explosion,Drone that crashed in Lithuania neutralised in a controlled explosion,/img/2026/05/18/2392737-277319-393x221.jpg
/en/news-in-english/19/2933328/lithuania-backs-armenia-s-eu-bid-foreign-minister-says-in-yerevan,"Lithuania backs Armenia’s EU bid, foreign minister says in Yerevan",/img/2020/02/13/601783-737720-615x345.jpg
/en/news-in-english/19/2932112/lithuanian-president-too-early-to-draw-conclusions-on-us-troop-movements,Lithuanian president: too early to draw conclusions on US troop movements,/img/2026/05/07/2384075-17559-615x345.jpg
/en/news-in-english/19/2925358/lithuanian-leaders-clash-over-possible-dialogue-with-belarus,Lithuanian leaders clash over possible dialogue with Belarus,/img/2026/05/01/2379729-246331-615x345.jpg
/en/news-in-english/19/2926062/council-of-europe-opening-belarus-information-point-in-vilnius,Council of Europe opening Belarus information point in Vilnius,/img/2020/04/27/644429-226063-615x345.jpg
/en/news-in-english/19/2932283/brussels-approves-eur153m-in-additional-funding-for-lithuania,Brussels approves €153m in additional funding for Lithuania,/img/2026/03/28/2355899-379958-615x345.jpg
/en/news-in-english/19/2932132/lithuania-risks-breaching-eu-fiscal-rules-as-defence-spending-mounts,Lithuania risks breaching EU fiscal rules as defence spending mounts,/img/2022/09/22/1348436-818889-615x345.jpg
/en/news-in-english/19/2929368/klaipeda-port-to-invest-over-eur70m-in-cruise-terminal-port-building,"Klaipėda Port to invest over €70m in cruise terminal, port building",/img/2020/02/19/605893-727848-615x345.jpg
/en/news-in-english/19/2928220/invl-raises-eur27-3m-for-rudninkai-military-campus-to-house-german-troops,INVL raises €27.3m for Rūdninkai military campus to house German troops,/img/2025/12/18/2269090-379941-615x345.jpg
/en/news-in-english/19/2933148/lithuania-ranks-among-worst-in-europe-on-transgender-rights-index-shows,"Lithuania ranks among worst in Europe on transgender rights, index shows",/img/2025/04/10/2041668-433742-615x345.jpg
/en/news-in-english/19/2925306/despite-favourable-court-rulings-same-sex-couples-face-new-roadblocks-in-lithuania,"Despite favourable court rulings, same-sex couples face new roadblocks in Lithuania",/img/2025/09/11/2179001-231934-615x345.jpg
/en/news-in-english/19/2927078/from-factories-to-theatres-lithuanian-chicago-opera-marks-70-year-anniversary,From factories to theatres: Lithuanian Chicago Opera marks 70-year anniversary,/img/2022/05/06/1254610-246410-615x345.png
/en/news-in-english/19/2926156/lithuania-s-health-system-is-locking-out-its-own-doctors,Lithuania's health system is locking out its own doctors,/img/2020/01/13/583594-928351-615x345.jpg
/en/news-in-english/19/2925378/kombucha-s-eastern-european-cousin-lithuanian-entrepreneur-bringing-gira-to-britain,‘Kombucha’s Eastern European cousin’: Lithuanian entrepreneur bringing Gira to Britain,/img/2026/05/05/2382210-74267-615x345.jpg
/en/news-in-english/19/2929110/ukrainian-drones-in-baltics-present-a-paradox-interview-with-stubb-in-vilnius,Ukrainian drones in Baltics present a paradox – interview with Stubb in Vilnius,/img/2026/05/14/2390118-742256-615x345.jpg
/en/news-in-english/19/2929001/lrt-english-newsletter-another-week-another-scandal-for-nemunas-dawn,"LRT English Newsletter: Another week, another scandal for Nemunas Dawn",/img/2026/05/14/2389497-95550-615x345.jpg
/en/news-in-english/19/2926276/from-zero-points-to-the-yellow-wave-lithuania-s-eurovision-journey-in-27-acts,From zero points to the ‘Yellow Wave’: Lithuania’s Eurovision journey in 27 acts,/img/2026/04/17/2369916-881063-615x345.jpg
