url,headline,img_path
/en/news-in-english/19/2962109/lithuania-has-a-new-prime-minister-what-do-we-know-about-him,Lithuania has a new prime minister – what do we know about him?,/img/2023/05/31/1522545-351153-150x84.jpg
/en/news-in-english/19/2962335/updated-air-passenger-rights-what-the-new-eu-rules-mean-for-travellers,Updated air passenger rights: what the new EU rules mean for travellers,/img/2025/11/26/2249706-620045-150x84.jpg
/en/news-in-english/19/2961332/tiktok-outrage-in-japan-leads-to-a-work-probe-in-lithuania,TikTok outrage in Japan leads to a work probe in Lithuania,/img/2025/07/02/2116999-221833-150x84.jpg
/en/news-in-english/19/2962200/lithuanian-parliament-to-consider-ban-on-artists-working-in-russia-belarus,"Lithuanian parliament to consider ban on artists working in Russia, Belarus",/img/2026/03/10/2341722-621553-150x84.jpg
/en/news-in-english/19/2962114/peace-can-no-longer-be-taken-for-granted-lithuanian-president-delivers-annual-address,‘Peace can no longer be taken for granted’: Lithuanian president delivers annual address,/img/2026/06/16/2417900-558825-150x84.jpg
/en/news-in-english/19/2962083/lithuanian-pm-to-step-down-sinkevicius-to-lead-new-government,"Lithuanian PM to step down, Sinkevičius to lead new government",/img/2026/06/11/2414499-390819-150x84.jpg
/en/news-in-english/19/2961150/baltic-pro-russian-activists-flee-to-belarus-embark-on-propaganda-mission,"Baltic pro-Russian activists flee to Belarus, embark on propaganda mission",/img/2026/06/10/2413462-818589-150x84.png
/en/news-in-english/19/2961296/lithuania-moves-to-scrap-unimplemented-border-travel-deal-with-belarus,Lithuania moves to scrap unimplemented border travel deal with Belarus,/img/2025/04/19/2049668-95042-150x84.jpg
/en/news-in-english/19/2961279/lithuania-to-maintain-belarus-border-pushbacks-despite-eu-migration-pact,Lithuania to maintain Belarus border pushbacks despite EU migration pact,/img/2021/06/15/990733-171220-150x84.jpg
/en/news-in-english/19/2961242/lithuanian-president-and-orthodox-church-condemn-attack-on-kyiv-s-pechersk-lavra,Lithuanian president and Orthodox Church condemn attack on Kyiv's Pechersk Lavra,/img/2026/06/15/2417109-181279-150x84.jpg
/en/news-in-english/19/2961205/canbalt-expects-lithuania-defence-hub-to-host-up-to-six-factories,CanBalt expects Lithuania defence hub to host up to six factories,/img/2025/10/02/2200558-254668-150x84.jpg
/en/news-in-english/19/2961181/lithuania-backs-eu-wide-entry-ban-for-russians-who-fought-in-ukraine,Lithuania backs EU-wide entry ban for Russians who fought in Ukraine,/img/2022/08/18/1324520-991192-150x84.jpg
/en/news-in-english/19/2961149/lithuanian-state-plant-begins-producing-anti-drone-ammunition,Lithuanian state plant begins producing anti-drone ammunition,/img/2026/06/15/2417246-714802-150x84.jpg
/en/news-in-english/19/2961103/lithuanian-coalition-deal-finalised-parties-await-prime-minister-announcement,"Lithuanian coalition deal finalised, parties await prime minister announcement",/img/2026/06/11/2414498-680461-150x84.jpg
/en/news-in-english/19/2961101/lithuania-to-host-european-space-education-resource-office,Lithuania to host European Space Education Resource Office,/img/2022/12/22/1413821-487943-150x84.jpg
/en/news-in-english/19/2961071/lithuanian-president-urged-swift-coalition-deal-defended-foreign-minister,"Lithuanian president urged swift coalition deal, defended foreign minister",/img/2026/05/18/2392692-533565-150x84.jpg
/en/news-in-english/19/2962083/lithuanian-pm-to-step-down-sinkevicius-to-lead-new-government,"Lithuanian PM to step down, Sinkevičius to lead new government",
/en/news-in-english/19/2962114/peace-can-no-longer-be-taken-for-granted-lithuanian-president-delivers-annual-address,‘Peace can no longer be taken for granted’: Lithuanian president delivers annual address,
/en/news-in-english/19/2962335/updated-air-passenger-rights-what-the-new-eu-rules-mean-for-travellers,Updated air passenger rights: what the new EU rules mean for travellers,/img/2025/11/26/2249706-620045-393x221.jpg
/en/news-in-english/19/2961332/tiktok-outrage-in-japan-leads-to-a-work-probe-in-lithuania,TikTok outrage in Japan leads to a work probe in Lithuania,/img/2025/07/02/2116999-221833-393x221.jpg
/en/news-in-english/19/2961150/baltic-pro-russian-activists-flee-to-belarus-embark-on-propaganda-mission,"Baltic pro-Russian activists flee to Belarus, embark on propaganda mission",/img/2026/06/10/2413462-818589-393x221.png
/en/news-in-english/19/2962200/lithuanian-parliament-to-consider-ban-on-artists-working-in-russia-belarus,"Lithuanian parliament to consider ban on artists working in Russia, Belarus",/img/2026/03/10/2341722-621553-615x345.jpg
/en/news-in-english/19/2962114/peace-can-no-longer-be-taken-for-granted-lithuanian-president-delivers-annual-address,‘Peace can no longer be taken for granted’: Lithuanian president delivers annual address,/img/2026/06/16/2417900-558825-393x221.jpg
/en/news-in-english/19/2962083/lithuanian-pm-to-step-down-sinkevicius-to-lead-new-government,"Lithuanian PM to step down, Sinkevičius to lead new government",/img/2026/06/11/2414499-390819-393x221.jpg
/en/news-in-english/19/2961296/lithuania-moves-to-scrap-unimplemented-border-travel-deal-with-belarus,Lithuania moves to scrap unimplemented border travel deal with Belarus,/img/2025/04/19/2049668-95042-393x221.jpg
/en/news-in-english/19/2961242/lithuanian-president-and-orthodox-church-condemn-attack-on-kyiv-s-pechersk-lavra,Lithuanian president and Orthodox Church condemn attack on Kyiv's Pechersk Lavra,/img/2026/06/15/2417109-181279-393x221.jpg
/en/news-in-english/19/2958257/russia-is-building-military-infrastructure-along-its-borders-with-northern-europe-baltics,"Russia is building military infrastructure along its borders with Northern Europe, Baltics",/img/2026/06/12/2415211-13507-615x345.jpg
/en/news-in-english/19/2956351/latvian-pm-ukrainian-drone-experts-arriving-in-latvia-next-week,Latvian PM: Ukrainian drone experts arriving in Latvia next week,/img/2026/06/10/2413105-64328-615x345.jpg
/en/news-in-english/19/2947218/nato-parliamentary-chief-blames-russia-for-drone-incursions-into-allied-territory,NATO parliamentary chief blames Russia for drone incursions into allied territory,/img/2022/05/11/1259100-628630-615x345.jpg
/en/news-in-english/19/2944215/how-the-russian-orthodox-church-targets-anti-war-priests,How the Russian Orthodox Church targets anti-war priests,/img/2022/11/24/1391273-757870-615x345.jpg
/en/news-in-english/19/2962335/updated-air-passenger-rights-what-the-new-eu-rules-mean-for-travellers,Updated air passenger rights: what the new EU rules mean for travellers,/img/2025/11/26/2249706-620045-615x345.jpg
/en/news-in-english/19/2957111/binance-withdraws-from-lithuania,Binance withdraws from Lithuania,/img/2026/06/11/2413519-211406-615x345.jpg
/en/news-in-english/19/2954339/eu-approves-eur884-million-plan-for-lithuania-to-cut-energy-costs-expand-public-transport,"EU approves €884 million plan for Lithuania to cut energy costs, expand public transport",/img/2026/01/11/2285574-428955-615x345.jpg
/en/news-in-english/19/2950305/should-algorithms-dictate-the-price-for-gig-workers-lithuanian-government-is-divided,Should algorithms dictate the price for gig workers? Lithuanian government is divided,/img/2025/12/14/2265614-231049-615x345.jpg
/en/news-in-english/19/2961332/tiktok-outrage-in-japan-leads-to-a-work-probe-in-lithuania,TikTok outrage in Japan leads to a work probe in Lithuania,/img/2025/07/02/2116999-221833-615x345.jpg
/en/news-in-english/19/2961279/lithuania-to-maintain-belarus-border-pushbacks-despite-eu-migration-pact,Lithuania to maintain Belarus border pushbacks despite EU migration pact,/img/2021/06/15/990733-171220-615x345.jpg
/en/news-in-english/19/2961063/lithuania-to-mark-occupation-and-genocide-day,Lithuania to mark Occupation and Genocide Day,/img/2019/10/03/523837-378454-615x345.jpg
/en/news-in-english/19/2956311/radio-dede-the-man-behind-lithuania-s-radio-history,‘Radio Dėdė’. The man behind Lithuania’s radio history,/img/2026/06/15/2417292-94954-615x345.jpg
/en/news-in-english/19/2962109/lithuania-has-a-new-prime-minister-what-do-we-know-about-him,Lithuania has a new prime minister – what do we know about him?,/img/2023/05/31/1522545-351153-615x345.jpg
/en/news-in-english/19/2961150/baltic-pro-russian-activists-flee-to-belarus-embark-on-propaganda-mission,"Baltic pro-Russian activists flee to Belarus, embark on propaganda mission",/img/2026/06/10/2413462-818589-615x345.png
/en/news-in-english/19/2958312/lithuania-gears-up-to-dismantle-chornobyl-type-reactors-for-the-first-time-in-the-world,Lithuania gears up to dismantle Chornobyl-type reactors – for the first time in the world,/img/2026/01/21/2294299-37368-615x345.jpg
/en/news-in-english/19/2958195/radio-history-from-1920s-pop-music-to-countering-fascism-in-lithuania,Radio history – from 1920s pop music to countering fascism in Lithuania,/img/2026/06/10/2413176-197797-615x345.jpg
