url,headline,img_path
/en/news-in-english/19/2898298/military-grounds-project-in-lithuania-passes-another-hurdle-amid-protests,Military grounds project in Lithuania passes another hurdle amid protests,/img/2025/08/11/2151051-576926-150x84.jpg
/en/news-in-english/19/2898244/lufthansa-strikes-cancel-more-vilnius-frankfurt-flights-bringing-weekly-total-to-23,"Lufthansa strikes cancel more Vilnius–Frankfurt flights, bringing weekly total to 23",/img/2026/04/14/2367242-182585-150x84.jpg
/en/news-in-english/19/2898232/former-seimas-speaker-skvernelis-denies-bribery-allegations-in-major-corruption-case,Former Seimas speaker Skvernelis denies bribery allegations in major corruption case,/img/2026/04/14/2367080-984255-150x84.jpg
/en/news-in-english/19/2898225/lithuania-temporarily-cuts-diesel-tax-to-ease-fuel-price-surge,Lithuania temporarily cuts diesel tax to ease fuel price surge,/img/2021/06/02/981827-834653-150x84.jpg
/en/news-in-english/19/2898188/vilnius-mayor-opposes-new-mosque-calls-for-migration-controls-instead,"Vilnius mayor opposes new mosque, calls for migration controls instead",/img/2025/04/14/2045499-669000-150x84.jpg
/en/news-in-english/19/2898108/lithuanian-fm-says-eu-should-contribute-to-unblocking-strait-of-hormuz,Lithuanian FM says EU should contribute to unblocking Strait of Hormuz,/img/2026/03/29/2356501-47999-150x84.jpg
/en/news-in-english/19/2898083/lithuanian-prosecutors-freeze-assets-of-former-pm-s-aide-in-corruption-probe,Lithuanian prosecutors freeze assets of former PM’s aide in corruption probe,/img/2026/02/23/2322844-440122-150x84.jpg
/en/news-in-english/19/2898072/unblocking-ukraine-loan-is-absolute-baseline-for-hungary-s-new-govt-lithuanian-fm,Unblocking Ukraine loan is ‘absolute baseline’ for Hungary’s new govt – Lithuanian FM,/img/2026/04/13/2366852-66881-150x84.jpg
/en/news-in-english/19/2897344/lithuania-urges-regional-countries-to-end-seasonal-clock-changes,Lithuania urges regional countries to end seasonal clock changes,/img/2025/09/09/2177389-339958-150x84.jpg
/en/news-in-english/19/2897377/lithuania-allows-german-firm-to-run-duty-free-shops-despite-work-in-belarus-russia,"Lithuania allows German firm to run duty-free shops despite work in Belarus, Russia",/img/2026/04/12/2366027-109373-150x84.png
/en/news-in-english/19/2897255/lithuania-s-military-begins-receiving-new-nasams-systems,Lithuania’s military begins receiving new NASAMS systems,/img/2023/11/10/1623469-594-150x84.jpg
/en/news-in-english/19/2897247/foundation-seeks-prosecution-of-israeli-student-in-lithuania-over-gaza-allegations,Foundation seeks prosecution of Israeli student in Lithuania over Gaza allegations,/img/2026/02/15/2316004-514264-150x84.jpg
/en/news-in-english/19/2897240/opposition-fails-to-delay-lrt-amendment-review-in-committee,Opposition fails to delay LRT amendment review in committee,/img/2025/08/31/2167860-325546-150x84.jpg
/en/news-in-english/19/2897182/more-vilnius-frankfurt-flights-cancelled-amid-lufthansa-pilots-strike,More Vilnius-Frankfurt flights cancelled amid Lufthansa pilots' strike,/img/2022/07/27/1311056-673786-150x84.jpg
/en/news-in-english/19/2897176/morningstar-dbrs-reaffirms-lithuania-s-a-rating-with-stable-outlook,Morningstar DBRS reaffirms Lithuania's A rating with stable outlook,/img/2026/03/24/2351893-358707-150x84.jpg
/en/news-in-english/19/2897113/lithuania-inaugurates-new-military-division-assigns-key-brigades,"Lithuania inaugurates new military division, assigns key brigades",/img/2024/04/29/1761250-475761-150x84.jpg
/en/news-in-english/19/2898232/former-seimas-speaker-skvernelis-denies-bribery-allegations-in-major-corruption-case,Former Seimas speaker Skvernelis denies bribery allegations in major corruption case,
/en/news-in-english/19/2898298/military-grounds-project-in-lithuania-passes-another-hurdle-amid-protests,Military grounds project in Lithuania passes another hurdle amid protests,
/en/news-in-english/19/2897377/lithuania-allows-german-firm-to-run-duty-free-shops-despite-work-in-belarus-russia,"Lithuania allows German firm to run duty-free shops despite work in Belarus, Russia",/img/2026/04/12/2366027-109373-393x221.png
/en/news-in-english/19/2898244/lufthansa-strikes-cancel-more-vilnius-frankfurt-flights-bringing-weekly-total-to-23,"Lufthansa strikes cancel more Vilnius–Frankfurt flights, bringing weekly total to 23",/img/2026/04/14/2367242-182585-393x221.jpg
/en/news-in-english/19/2898225/lithuania-temporarily-cuts-diesel-tax-to-ease-fuel-price-surge,Lithuania temporarily cuts diesel tax to ease fuel price surge,/img/2021/06/02/981827-834653-393x221.jpg
/en/news-in-english/19/2898298/military-grounds-project-in-lithuania-passes-another-hurdle-amid-protests,Military grounds project in Lithuania passes another hurdle amid protests,/img/2025/08/11/2151051-576926-615x345.jpg
/en/news-in-english/19/2898232/former-seimas-speaker-skvernelis-denies-bribery-allegations-in-major-corruption-case,Former Seimas speaker Skvernelis denies bribery allegations in major corruption case,/img/2026/04/14/2367080-984255-393x221.jpg
/en/news-in-english/19/2898108/lithuanian-fm-says-eu-should-contribute-to-unblocking-strait-of-hormuz,Lithuanian FM says EU should contribute to unblocking Strait of Hormuz,/img/2026/03/29/2356501-47999-393x221.jpg
/en/news-in-english/19/2898083/lithuanian-prosecutors-freeze-assets-of-former-pm-s-aide-in-corruption-probe,Lithuanian prosecutors freeze assets of former PM’s aide in corruption probe,/img/2026/02/23/2322844-440122-393x221.jpg
/en/news-in-english/19/2898072/unblocking-ukraine-loan-is-absolute-baseline-for-hungary-s-new-govt-lithuanian-fm,Unblocking Ukraine loan is ‘absolute baseline’ for Hungary’s new govt – Lithuanian FM,/img/2026/04/13/2366852-66881-393x221.jpg
/en/news-in-english/19/2894357/baltic-states-reject-russian-claim-they-allowed-airspace-for-ukraine-strikes,Baltic states reject Russian claim they allowed airspace for Ukraine strikes,/img/2022/03/30/1228061-310338-615x345.jpg
/en/news-in-english/19/2891192/belarus-cancels-passport-of-nobel-laureate,Belarus cancels passport of Nobel laureate,/img/2026/04/03/2360911-424775-615x345.jpg
/en/news-in-english/19/2887228/former-nato-chief-stoltenberg-considered-talks-with-russia-without-eastern-allies-media,Former NATO chief Stoltenberg considered talks with Russia without eastern allies – media,/img/2023/07/10/1546841-450875-615x345.jpg
/en/news-in-english/19/2886121/lithuanian-sentenced-to-15-years-in-belarus-prison-officials-perceive-pressure-tactics,"Lithuanian sentenced to 15 years in Belarus prison, officials perceive pressure tactics",/img/2025/01/14/1966000-603667-615x345.jpg
/en/news-in-english/19/2898244/lufthansa-strikes-cancel-more-vilnius-frankfurt-flights-bringing-weekly-total-to-23,"Lufthansa strikes cancel more Vilnius–Frankfurt flights, bringing weekly total to 23",/img/2026/04/14/2367242-182585-615x345.jpg
/en/news-in-english/19/2898225/lithuania-temporarily-cuts-diesel-tax-to-ease-fuel-price-surge,Lithuania temporarily cuts diesel tax to ease fuel price surge,/img/2021/06/02/981827-834653-615x345.jpg
/en/news-in-english/19/2897176/morningstar-dbrs-reaffirms-lithuania-s-a-rating-with-stable-outlook,Morningstar DBRS reaffirms Lithuania's A rating with stable outlook,/img/2026/03/24/2351893-358707-615x345.jpg
/en/news-in-english/19/2892049/lithuanian-emigration-shifts-fewer-heading-to-uk-more-eyeing-tax-havens,"Lithuanian emigration shifts: fewer heading to UK, more eyeing tax havens",/img/2026/03/19/2348224-235252-615x345.jpg
/en/news-in-english/19/2898188/vilnius-mayor-opposes-new-mosque-calls-for-migration-controls-instead,"Vilnius mayor opposes new mosque, calls for migration controls instead",/img/2025/04/14/2045499-669000-615x345.jpg
/en/news-in-english/19/2894295/new-york-designates-lithuanian-building-as-historic-landmark,New York designates Lithuanian building as historic landmark,/img/2026/04/10/2364974-444283-615x345.jpg
/en/news-in-english/19/2894130/lithuania-suspends-ivf-services-for-new-patients-after-court-ruling-media,Lithuania suspends IVF services for new patients after court ruling – media,/img/2026/04/10/2364770-507583-615x345.jpg
/en/news-in-english/19/2892150/romani-flag-to-fly-at-vilnius-tv-tower-to-mark-international-romani-day,Romani flag to fly at Vilnius TV Tower to mark International Romani Day,/img/2024/04/08/1745770-723312-615x345.jpg
/en/news-in-english/19/2892049/lithuanian-emigration-shifts-fewer-heading-to-uk-more-eyeing-tax-havens,"Lithuanian emigration shifts: fewer heading to UK, more eyeing tax havens",/img/2026/03/19/2348224-235252-615x345.jpg
/en/news-in-english/19/2884478/the-lithuanian-madonna-the-little-known-artist-who-left-her-mark-from-hawaii-to-chicago,The Lithuanian Madonna: the little-known artist who left her mark from Hawaii to Chicago,/img/2026/03/23/2351116-427644-615x345.jpg
/en/news-in-english/19/2893209/lrt-english-newsletter-we-are-once-again-asking,LRT English Newsletter: We are once again asking,/img/2026/04/08/2363457-326239-615x345.jpg
/en/news-in-english/19/2891226/could-iran-war-trigger-repeat-of-2008-financial-crisis-in-lithuania,Could Iran war trigger repeat of 2008 financial crisis in Lithuania?,/img/2026/04/03/2360600-131428-615x345.jpg
