url,headline,img_path
/en/news-in-english/19/2929001/lrt-english-newsletter-another-week-another-scandal-for-nemunas-dawn,"LRT English Newsletter: Another week, another scandal for Nemunas Dawn",/img/2026/05/14/2389497-95550-150x84.jpg
/en/news-in-english/19/2928424/lithuanian-police-hunt-suspects-in-latvian-atm-thefts,Lithuanian police hunt suspects in Latvian ATM thefts,/img/2026/05/14/2389771-713032-150x84.jpg
/en/news-in-english/19/2928366/ex-pm-paluckas-charged-with-illicit-enrichment,Ex-PM Paluckas charged with illicit enrichment,/img/2026/05/14/2389864-968389-150x84.jpg
/en/news-in-english/19/2928311/lithuanian-finnish-presidents-call-for-stronger-air-defences-after-drone-incidents,"Lithuanian, Finnish presidents call for stronger air defences after drone incidents",/img/2026/05/14/2389604-892367-150x84.jpg
/en/news-in-english/19/2928308/lithuanian-president-says-no-point-engaging-russia-until-it-ends-ukraine-war,Lithuanian president says no point engaging Russia until it ends Ukraine war,/img/2026/05/14/2389601-995168-150x84.jpg
/en/news-in-english/19/2928232/lithuania-under-pressure-from-us-to-renew-belarusian-fertiliser-transit-says-fm,"Lithuania under pressure from US to renew Belarusian fertiliser transit, says FM",/img/2022/11/24/1391065-765362-150x84.jpg
/en/news-in-english/19/2928220/invl-raises-eur27-3m-for-rudninkai-military-campus-to-house-german-troops,INVL raises €27.3m for Rūdninkai military campus to house German troops,/img/2025/12/18/2269090-379941-150x84.jpg
/en/news-in-english/19/2928137/lithuania-to-commemorate-kalanta-self-immolation-protest-against-soviets,Lithuania to commemorate Kalanta self-immolation protest against Soviets,/img/2022/07/05/1296632-360474-150x84.jpg
/en/news-in-english/19/2928116/lithuania-denies-airspace-use-for-drone-strikes-calls-claims-russian-disinformation,"Lithuania denies airspace use for drone strikes, calls claims Russian disinformation",/img/2022/08/26/1330543-945448-150x84.jpg
/en/news-in-english/19/2928077/lithuania-defence-minister-says-us-troop-deployment-halt-is-temporary,Lithuania defence minister says US troop deployment halt is temporary,/img/2026/02/19/2318734-238639-150x84.jpg
/en/news-in-english/19/2928070/lithuanian-financial-crimes-watchdog-searches-office-of-nemunas-dawn-leader,Lithuanian financial crimes watchdog searches office of Nemunas Dawn leader,/img/2026/05/14/2389238-28988-150x84.jpg
/en/news-in-english/19/2926156/lithuania-s-health-system-is-locking-out-its-own-doctors,Lithuania's health system is locking out its own doctors,/img/2020/01/13/583594-928351-150x84.jpg
/en/news-in-english/19/2927277/abortion-ban-to-free-meals-lithuanian-parties-diverge-on-how-to-boost-birth-rates,Abortion ban to free meals – Lithuanian parties diverge on how to boost birth rates,/img/2021/04/29/958047-280659-150x84.jpg
/en/news-in-english/19/2927338/french-court-allows-extradition-of-former-banker-antonov-to-lithuania,French court allows extradition of former banker Antonov to Lithuania,/img/2025/12/11/2263271-463328-150x84.jpg
/en/news-in-english/19/2927319/there-are-no-perfect-laws-parliament-committee-approves-changes-to-lrt,‘There are no perfect laws’: Parliament committee approves changes to LRT,/img/2025/11/27/2250538-681774-150x84.jpg
/en/news-in-english/19/2927215/minister-criticises-calls-to-impose-lithuanian-language-rules-on-all-foreign-residents,Minister criticises calls to impose Lithuanian language rules on all foreign residents,/img/2026/03/24/2351988-242551-150x84.jpg
/en/news-in-english/19/2929001/lrt-english-newsletter-another-week-another-scandal-for-nemunas-dawn,"LRT English Newsletter: Another week, another scandal for Nemunas Dawn",
/en/news-in-english/19/2928424/lithuanian-police-hunt-suspects-in-latvian-atm-thefts,Lithuanian police hunt suspects in Latvian ATM thefts,
/en/news-in-english/19/2928366/ex-pm-paluckas-charged-with-illicit-enrichment,Ex-PM Paluckas charged with illicit enrichment,/img/2026/05/14/2389864-968389-393x221.jpg
/en/news-in-english/19/2928311/lithuanian-finnish-presidents-call-for-stronger-air-defences-after-drone-incidents,"Lithuanian, Finnish presidents call for stronger air defences after drone incidents",/img/2026/05/14/2389604-892367-393x221.jpg
/en/news-in-english/19/2928308/lithuanian-president-says-no-point-engaging-russia-until-it-ends-ukraine-war,Lithuanian president says no point engaging Russia until it ends Ukraine war,/img/2026/05/14/2389601-995168-393x221.jpg
/en/news-in-english/19/2928424/lithuanian-police-hunt-suspects-in-latvian-atm-thefts,Lithuanian police hunt suspects in Latvian ATM thefts,/img/2026/05/14/2389771-713032-615x345.jpg
/en/news-in-english/19/2928366/ex-pm-paluckas-charged-with-illicit-enrichment,Ex-PM Paluckas charged with illicit enrichment,/img/2026/05/14/2389864-968389-393x221.jpg
/en/news-in-english/19/2928311/lithuanian-finnish-presidents-call-for-stronger-air-defences-after-drone-incidents,"Lithuanian, Finnish presidents call for stronger air defences after drone incidents",/img/2026/05/14/2389604-892367-393x221.jpg
/en/news-in-english/19/2928308/lithuanian-president-says-no-point-engaging-russia-until-it-ends-ukraine-war,Lithuanian president says no point engaging Russia until it ends Ukraine war,/img/2026/05/14/2389601-995168-393x221.jpg
/en/news-in-english/19/2928232/lithuania-under-pressure-from-us-to-renew-belarusian-fertiliser-transit-says-fm,"Lithuania under pressure from US to renew Belarusian fertiliser transit, says FM",/img/2022/11/24/1391065-765362-393x221.jpg
/en/news-in-english/19/2925358/lithuanian-leaders-clash-over-possible-dialogue-with-belarus,Lithuanian leaders clash over possible dialogue with Belarus,/img/2026/05/01/2379729-246331-615x345.jpg
/en/news-in-english/19/2926062/council-of-europe-opening-belarus-information-point-in-vilnius,Council of Europe opening Belarus information point in Vilnius,/img/2020/04/27/644429-226063-615x345.jpg
/en/news-in-english/19/2925249/ukraine-ready-for-serious-talks-with-russia-budanov-in-vilnius,Ukraine ready for serious talks with Russia – Budanov in Vilnius,/img/2026/02/27/2328118-90915-615x345.jpg
/en/news-in-english/19/2925060/ukraine-intelligence-chief-budanov-visits-lithuania-for-security-meetings,Ukraine intelligence chief Budanov visits Lithuania for security meetings,/img/2026/02/27/2327626-439545-615x345.jpg
/en/news-in-english/19/2928220/invl-raises-eur27-3m-for-rudninkai-military-campus-to-house-german-troops,INVL raises €27.3m for Rūdninkai military campus to house German troops,/img/2025/12/18/2269090-379941-615x345.jpg
/en/news-in-english/19/2927171/rheintmetall-ammo-factory-construction-in-lithuania-slightly-behind-schedule,Rheintmetall ammo factory construction in Lithuania ‘slightly behind’ schedule,/img/2025/11/04/2230800-208152-615x345.jpg
/en/news-in-english/19/2927123/airbaltic-cancels-summer-flights-between-vilnius-and-krakow,airBaltic cancels summer flights between Vilnius and Krakow,/img/2025/01/02/1956612-953484-615x345.jpg
/en/news-in-english/19/2927076/suspected-smuggling-balloons-disrupt-flights-at-vilnius-airport,Suspected smuggling balloons disrupt flights at Vilnius Airport,/img/2025/11/26/2249710-541758-615x345.jpg
/en/news-in-english/19/2926156/lithuania-s-health-system-is-locking-out-its-own-doctors,Lithuania's health system is locking out its own doctors,/img/2020/01/13/583594-928351-615x345.jpg
/en/news-in-english/19/2927277/abortion-ban-to-free-meals-lithuanian-parties-diverge-on-how-to-boost-birth-rates,Abortion ban to free meals – Lithuanian parties diverge on how to boost birth rates,/img/2021/04/29/958047-280659-615x345.jpg
/en/news-in-english/19/2927061/lithuania-advances-to-eurovision-final,Lithuania advances to Eurovision final,/img/2026/05/12/2388204-266176-615x345.jpg
/en/news-in-english/19/2922188/not-funny-anymore-would-government-sponsored-discos-raise-lithuania-s-fertility-rates,‘Not funny anymore’: Would government-sponsored discos raise Lithuania’s fertility rates?,/img/2024/07/05/1811532-883064-615x345.jpg
/en/news-in-english/19/2929001/lrt-english-newsletter-another-week-another-scandal-for-nemunas-dawn,"LRT English Newsletter: Another week, another scandal for Nemunas Dawn",/img/2026/05/14/2389497-95550-615x345.jpg
/en/news-in-english/19/2926276/from-zero-points-to-the-yellow-wave-lithuania-s-eurovision-journey-in-27-acts,From zero points to the ‘Yellow Wave’: Lithuania’s Eurovision journey in 27 acts,/img/2026/04/17/2369916-881063-615x345.jpg
/en/news-in-english/19/2922245/quiz-baltic-states-trivia,Quiz: Baltic states trivia,/img/2026/04/03/2360243-641867-615x345.jpg
/en/news-in-english/19/2920167/once-dismissed-as-a-dying-craft-lithuanian-weaving-is-having-its-moment,"Once dismissed as a dying craft, Lithuanian weaving is having its moment",/img/2026/04/14/2367397-132027-615x345.jpg
